,id,conversation_id,created_at,date,time,timezone,user_id,username,name,place,tweet,language,mentions,urls,photos,replies_count,retweets_count,likes_count,hashtags,cashtags,link,retweet,quote_url,video,thumbnail,near,geo,source,user_rt_id,user_rt,retweet_id,reply_to,retweet_date,translate,trans_src,trans_dest
12,1343406294166863874,1343406294166863872,2020-12-28 04:59:54 ora solare Europa occidentale,2020-12-28,04:59:54,200,151967576,attorneycrump,Ben Crump,,Congrats @NaomiOsaka — named @AP Female Athlete of the Year!! 👏🏾,en,"[{'screen_name': 'naomiosaka', 'name': 'naomiosaka大坂なおみ', 'id': '773280684173463552'}, {'screen_name': 'ap', 'name': 'the associated press', 'id': '51241574'}]",[],[],10,203,1851,[],[],https://twitter.com/AttorneyCrump/status/1343406294166863874,False,https://twitter.com/AttorneyCrump/status/1303527085336600577,0,,,,,,,,[],,,,
13,1343402415589089282,1343402415589089280,2020-12-28 04:44:29 ora solare Europa occidentale,2020-12-28,04:44:29,200,151967576,attorneycrump,Ben Crump,,When you’re watching @ghoststarz and they say your name... 😮 #powerbook2ghost  https://t.co/ySkVrB7APx,en,"[{'screen_name': 'ghoststarz', 'name': 'power book ii: ghost', 'id': '1198043512089931776'}]",[],[],61,73,1128,['powerbook2ghost'],[],https://twitter.com/AttorneyCrump/status/1343402415589089282,False,,1,https://pbs.twimg.com/ext_tw_video_thumb/1343402363013525504/pu/img/c3S5vOOpO3VIpS4c.jpg,,,,,,,[],,,,
0,1344054589864239104,1344054589864239104,2020-12-29 23:56:00 ora solare Europa occidentale,2020-12-29,23:56:00,200,151967576,attorneycrump,Ben Crump,,"""Why me, mom?"" It breaks my heart to hear how Keyon Harrold Jr's mother had to answer her son's question of why he was the target of racial discrimination. Unfortunately, this is a conversation all of us parents of Black kids must have at some point in their young lives.  https://t.co/j8wgrHbgkY",en,[],[],[],33,278,1058,[],[],https://twitter.com/AttorneyCrump/status/1344054589864239104,False,,1,https://pbs.twimg.com/amplify_video_thumb/1344035128603979776/img/EtkNwMVCIxWUxlTK.jpg,,,,,,,[],,,,
1,1344053331497418755,1344053331497418752,2020-12-29 23:51:00 ora solare Europa occidentale,2020-12-29,23:51:00,200,151967576,attorneycrump,Ben Crump,,We must do away with the double standard that deems Black people GUILTY until proven innocent! That’s why we are requesting a civil rights investigation into @ArloHotels. No one should experience the injustice 14yo Keyon Harrold Jr. felt on Saturday!  https://t.co/TCa7jKzupV,en,"[{'screen_name': 'arlohotels', 'name': 'arlo hotels', 'id': '738787420481683460'}]",[],[],15,144,553,[],[],https://twitter.com/AttorneyCrump/status/1344053331497418755,False,,1,https://pbs.twimg.com/amplify_video_thumb/1344035087680212999/img/wKEfwGNHnvDCQ5vf.jpg,,,,,,,[],,,,
2,1344033522219163654,1344033450697879552,2020-12-29 22:32:17 ora solare Europa occidentale,2020-12-29,22:32:17,200,151967576,attorneycrump,Ben Crump,,"Corporations and municipalities inflict their pollution on communities of color, locating landfills, coal plants, hazardous waste and much more nearby, creating public health threats for marginalized residents. We must fight these injustices!",en,[],[],[],2,32,187,[],[],https://twitter.com/AttorneyCrump/status/1344033522219163654,False,,0,,,,,,,,[],,,,
3,1344033450697879553,1344033450697879552,2020-12-29 22:32:00 ora solare Europa occidentale,2020-12-29,22:32:00,200,151967576,attorneycrump,Ben Crump,,"Artist Sergio Maciel created a powerful visual representation of the structural racism that underpins Chicago and many other cities across America, fueling health inequities and environmental injustices.  https://t.co/zwMC9ZVjWr",en,[],[],['https://pbs.twimg.com/media/EqWXnOqXYAI8q6Q.png'],5,96,495,[],[],https://twitter.com/AttorneyCrump/status/1344033450697879553,False,,1,https://pbs.twimg.com/media/EqWXnOqXYAI8q6Q.png,,,,,,,[],,,,
4,1344006774882332672,1344006774882332672,2020-12-29 20:46:00 ora solare Europa occidentale,2020-12-29,20:46:00,200,151967576,attorneycrump,Ben Crump,,Black Lives Matter! People globally feel the impact of our struggle because what’s happening in America is that striking! Thanks @thetimes for shining a light on racial inequalities facing the Black community. We must fight for liberty and justice for ALL!  https://t.co/qhN14qoYtw,en,"[{'screen_name': 'thetimes', 'name': 'the times and the sunday times', 'id': '6107422'}]",['https://www.thetimes.co.uk/article/george-floyds-family-lawyer-ben-crump-on-americas-year-of-soul-searching-jcngtqkpk'],[],7,65,315,[],[],https://twitter.com/AttorneyCrump/status/1344006774882332672,False,,0,,,,,,,,[],,,,
5,1344005504176160771,1344002840897986560,2020-12-29 20:40:57 ora solare Europa occidentale,2020-12-29,20:40:57,200,151967576,attorneycrump,Ben Crump,,"@Yamiche Send a clear message that hateful, racially motivated behavior is unacceptable. Email Manhattan DA Cy Vance Jr. and urge him to charge the woman who attacked Keyon Harrold Jr:  https://t.co/yVEOt0xs5h",en,[],['https://act.bencrump.com/a/keyon-harrold'],[],12,102,432,[],[],https://twitter.com/AttorneyCrump/status/1344005504176160771,False,,0,,,,,,,,"[{'screen_name': 'Yamiche', 'name': 'Yamiche Alcindor', 'id': '89887215'}]",,,,
6,1343988655572971520,1343988655572971520,2020-12-29 19:34:00 ora solare Europa occidentale,2020-12-29,19:34:00,200,151967576,attorneycrump,Ben Crump,,"It only took 2 weeks for someone to vandalize this Breonna Taylor statue. It's a shame some people carry so much hate in their hearts!  ""The most disrespected person in America is the Black woman."" -Malcolm X Despite this racist act, we will #SayHerName ✊🏾  https://t.co/9eBD35nCIB",en,[],['https://www.cbsnews.com/news/breonna-taylor-bust-smashed-oakland-outrage/'],[],56,336,1377,['sayhername'],[],https://twitter.com/AttorneyCrump/status/1343988655572971520,False,,0,,,,,,,,[],,,,
7,1343978085767467008,1343978085767467008,2020-12-29 18:52:00 ora solare Europa occidentale,2020-12-29,18:52:00,200,151967576,attorneycrump,Ben Crump,,"Officer Adam Coy fatally shot Andre Hill. His termination was only the first step in getting justice! Officers treated Andre like an animal, refusing to render aid and leaving him for dead. They watched as life left his body. Someone must answer for that! #JusticeForAndreHill  https://t.co/18JBduopkn",en,[],[],[],20,210,617,['justiceforandrehill'],[],https://twitter.com/AttorneyCrump/status/1343978085767467008,False,,1,https://pbs.twimg.com/amplify_video_thumb/1343968045685989376/img/r_03o4Gug_n0hYTd.jpg,,,,,,,[],,,,
8,1343969467009806336,1343969467009806336,2020-12-29 18:17:45 ora solare Europa occidentale,2020-12-29,18:17:45,200,151967576,attorneycrump,Ben Crump,,False allegations endanger young Black lives! We must send a message that our kids are NOT criminals due to the color of their skin — and NOT guilty until proven innocent! Urge @ManhattanDA to bring charges against the woman who attacked @KeyonHarrold Jr:  https://t.co/yVEOt0xs5h  https://t.co/i6SYN8M7aI,en,"[{'screen_name': 'manhattanda', 'name': 'alvin bragg', 'id': '66368876'}, {'screen_name': 'keyonharrold', 'name': 'keyon harrold', 'id': '24614057'}]",['https://act.bencrump.com/a/keyon-harrold'],[],24,185,652,[],[],https://twitter.com/AttorneyCrump/status/1343969467009806336,False,,1,https://pbs.twimg.com/amplify_video_thumb/1343969185488117760/img/iM-vRcQAUnk4YLIo.jpg,,,,,,,[],,,,
9,1343958611706474504,1343958611706474496,2020-12-29 17:34:37 ora solare Europa occidentale,2020-12-29,17:34:37,200,151967576,attorneycrump,Ben Crump,,Ben Crump demands charges against ‘Karen’ who allegedly attacked Black teen at hotel #BlackLivesMatter  https://t.co/nCsDAzQqM5,en,[],['https://news.yahoo.com/ben-crump-demands-charges-against-192557328.html'],[],19,130,733,['blacklivesmatter'],[],https://twitter.com/AttorneyCrump/status/1343958611706474504,False,,0,,,,,,,,[],,,,
10,1343938072136835073,1343938072136835072,2020-12-29 16:13:00 ora solare Europa occidentale,2020-12-29,16:13:00,200,151967576,attorneycrump,Ben Crump,,Almost 500K African Americans have HIV – with 15K more each year! But @GileadSciences continues its exploitation by putting profits over people. They sold #Truvada (causes kidney damage) while keeping safer drugs off the market! We will keep fighting for victims to get justice!  https://t.co/WcOTJpnXlq,en,"[{'screen_name': 'gileadsciences', 'name': 'gilead sciences', 'id': '309728693'}]",[],['https://pbs.twimg.com/media/EqWV4w5XUAEDSJH.jpg'],7,88,328,['truvada'],[],https://twitter.com/AttorneyCrump/status/1343938072136835073,False,,1,https://pbs.twimg.com/media/EqWV4w5XUAEDSJH.jpg,,,,,,,[],,,,
11,1343752600076701696,1343752600076701696,2020-12-29 03:56:00 ora solare Europa occidentale,2020-12-29,03:56:00,200,151967576,attorneycrump,Ben Crump,,What would @ArloHotels manager &amp; security guards have done had they witnessed a Black man tackle a white teen in furious pursuit of a missing phone? It would have gone very different than what was @KeyonHarrold and his 14yo son experienced on Saturday morning!  https://t.co/e1MbSL4e2A,en,"[{'screen_name': 'arlohotels', 'name': 'arlo hotels', 'id': '738787420481683460'}, {'screen_name': 'keyonharrold', 'name': 'keyon harrold', 'id': '24614057'}]",[],[],81,342,1184,[],[],https://twitter.com/AttorneyCrump/status/1343752600076701696,False,,1,https://pbs.twimg.com/amplify_video_thumb/1343736619409547267/img/nV--Zn2mVyJGyRn9.jpg,,,,,,,[],,,,
12,1343736567169511425,1343736567169511424,2020-12-29 02:52:17 ora solare Europa occidentale,2020-12-29,02:52:17,200,151967576,attorneycrump,Ben Crump,,Breaking News: @ColumbusSafety will terminate @ColumbusPolice Officer Adam Coy after he shot and killed #AndreHill  https://t.co/ySfbvLQjul,en,"[{'screen_name': 'columbussafety', 'name': 'columbus department of public safety', 'id': '1293986358038601728'}, {'screen_name': 'columbuspolice', 'name': 'columbus ohio police', 'id': '40010656'}]",[],['https://pbs.twimg.com/media/EqXpSRUXYAEQ8G8.jpg'],19,95,438,['andrehill'],[],https://twitter.com/AttorneyCrump/status/1343736567169511425,False,https://twitter.com/ColumbusSafety/status/1343689288328892420,1,https://pbs.twimg.com/media/EqXpSRUXYAEQ8G8.jpg,,,,,,,[],,,,
13,1343735235524009984,1343735235524009984,2020-12-29 02:47:00 ora solare Europa occidentale,2020-12-29,02:47:00,200,151967576,attorneycrump,Ben Crump,,"This visual analysis by @nytimes presents a clear picture of what happened to Breonna Taylor. More evidence proves that police did NOT announce themselves during the raid, officers used excessive force, and Bre and Kenneth were INNOCENT.   https://t.co/iTiEgi8mLn",en,"[{'screen_name': 'nytimes', 'name': 'the new york times', 'id': '807095'}]",['https://www.nytimes.com/video/us/100000007348445/breonna-taylor-death-cops.html'],[],26,247,622,[],[],https://twitter.com/AttorneyCrump/status/1343735235524009984,False,,0,,,,,,,,[],,,,
14,1343719832857014274,1343719613427838976,2020-12-29 01:45:47 ora solare Europa occidentale,2020-12-29,01:45:47,200,151967576,attorneycrump,Ben Crump,,"Now @KeyonHarrold and I are calling on @ManhattanDA to charge that woman with assault and battery, sending a clear message that hateful, racially motivated behavior is unacceptable. Join us by emailing DA Cy Vance Jr. now:  https://t.co/yVEOt0xs5h",en,"[{'screen_name': 'keyonharrold', 'name': 'keyon harrold', 'id': '24614057'}, {'screen_name': 'manhattanda', 'name': 'alvin bragg', 'id': '66368876'}]",['https://act.bencrump.com/a/keyon-harrold'],[],51,492,1881,[],[],https://twitter.com/AttorneyCrump/status/1343719832857014274,False,,0,,,,,,,,[],,,,
15,1343719613427838976,1343719613427838976,2020-12-29 01:44:55 ora solare Europa occidentale,2020-12-29,01:44:55,200,151967576,attorneycrump,Ben Crump,,"As a Grammy-winning Jazz musician, @KeyonHarrold’s relies on his hands for his livelihood. But on Saturday morning, those hands were injured while protecting his son from a raving lunatic. She falsely accused him of stealing her phone and must be held accountable for that attack!  https://t.co/RX2uo67PWJ",en,"[{'screen_name': 'keyonharrold', 'name': 'keyon harrold', 'id': '24614057'}]",[],[],169,902,3477,[],[],https://twitter.com/AttorneyCrump/status/1343719613427838976,False,,1,https://pbs.twimg.com/amplify_video_thumb/1343690769350221824/img/V7hOVnYGOif-1J47.jpg,,,,,,,[],,,,
0,1344400290833956865,1344400108943761408,2020-12-30 22:49:41 ora solare Europa occidentale,2020-12-30,22:49:41,200,151967576,attorneycrump,Ben Crump,,"By including false info in a warrant affidavit, Det. Joshua Jaynes committed perjury and should be charged w/ breaking his oath as the affiant. Det. Cosgrove recklessly opened fire in Breonna Taylor's home w/ complete disregard for human life, never identifying a specific target.",en,[],[],[],3,55,290,[],[],https://twitter.com/AttorneyCrump/status/1344400290833956865,False,,0,,,,,,,,[],,,,
1,1344400208973721602,1344400108943761408,2020-12-30 22:49:22 ora solare Europa occidentale,2020-12-30,22:49:22,200,151967576,attorneycrump,Ben Crump,,"There is no revelation here. Thanks to the assertion of Louisville postal inspector Tony Gooden, we’ve known for 7+ months the warrant executed in the Breonna Taylor case was based on lies. Her death was the direct result of lies, corruption, and complete malfeasance by @LMPD.",en,"[{'screen_name': 'lmpd', 'name': 'lmpd', 'id': '18904764'}]",[],[],2,60,323,[],[],https://twitter.com/AttorneyCrump/status/1344400208973721602,False,,0,,,,,,,,[],,,,
2,1344400108943761408,1344400108943761408,2020-12-30 22:48:58 ora solare Europa occidentale,2020-12-30,22:48:58,200,151967576,attorneycrump,Ben Crump,,"The @LMPD finally admitted they intend to fire Joshua Jaynes and Myles Cosgrove! Ultimately, both should be held criminally liable. I applaud Chief Gentry's diligent efforts to investigate the events of Breonna Taylor's murder &amp; not defer to the incompetence of @kyoag's office.",en,"[{'screen_name': 'lmpd', 'name': 'lmpd', 'id': '18904764'}, {'screen_name': 'kyoag', 'name': 'attorney general daniel cameron', 'id': '1205238738097455104'}]",[],[],17,168,935,[],[],https://twitter.com/AttorneyCrump/status/1344400108943761408,False,,0,,,,,,,,[],,,,
3,1344381680220598278,1344381680220598272,2020-12-30 21:35:44 ora solare Europa occidentale,2020-12-30,21:35:44,200,151967576,attorneycrump,Ben Crump,,"We are calling on the @ManhattanDA &amp; @ArloHotels to hold the woman who attacked @KeyonHarrold Jr. accountable. Especially considering she is falsely accusing the Harrold’s of attacking her, despite video evidence that proves otherwise. We must put an end to this nonsense!  https://t.co/lOHLbQWhZl",en,"[{'screen_name': 'manhattanda', 'name': 'alvin bragg', 'id': '66368876'}, {'screen_name': 'arlohotels', 'name': 'arlo hotels', 'id': '738787420481683460'}, {'screen_name': 'keyonharrold', 'name': 'keyon harrold', 'id': '24614057'}]",[],[],77,430,1762,[],[],https://twitter.com/AttorneyCrump/status/1344381680220598278,False,,1,https://pbs.twimg.com/amplify_video_thumb/1344380627395731457/img/-dEHy2t63g_CziqY.jpg,,,,,,,[],,,,
4,1344322858105909248,1344322858105909248,2020-12-30 17:42:00 ora solare Europa occidentale,2020-12-30,17:42:00,200,151967576,attorneycrump,Ben Crump,,Watch news conference LIVE as we demand justice for Keyon Harrold Jr. (via @TND):  https://t.co/t6fUCx0AAh,en,"[{'screen_name': 'tnd', 'name': 'the national desk', 'id': '441389311'}]",['https://www.facebook.com/TND/videos/401475634635857'],[],2,29,136,[],[],https://twitter.com/AttorneyCrump/status/1344322858105909248,False,,0,,,,,,,,[],,,,
5,1344291996513533956,1344291996513533952,2020-12-30 15:39:22 ora solare Europa occidentale,2020-12-30,15:39:22,200,151967576,attorneycrump,Ben Crump,,"“No! He’s not leaving. Show me the proof,” is the voice of privilege! This woman insisted that @KeyonHarrold Jr. was guilty until proven innocent; that’s NOT the way things go. This is why we fight for justice; we will not tolerate discrimination against Black people any longer!  https://t.co/irHPRUqO4L",en,"[{'screen_name': 'keyonharrold', 'name': 'keyon harrold', 'id': '24614057'}]",[],[],80,287,1378,[],[],https://twitter.com/AttorneyCrump/status/1344291996513533956,False,,1,https://pbs.twimg.com/amplify_video_thumb/1344286480181694464/img/FksrcFU66V63G9Pt.jpg,,,,,,,[],,,,
6,1344082313928445954,1344082313928445952,2020-12-30 01:46:10 ora solare Europa occidentale,2020-12-30,01:46:10,200,151967576,attorneycrump,Ben Crump,,Breaking: @LMPD with terminate employment of officer Joshua Jaynes. He requested the search warrant that led to the tragic murder of #BreonnaTaylor.  https://t.co/C4jf1LAXUg,en,"[{'screen_name': 'lmpd', 'name': 'lmpd', 'id': '18904764'}]",[],"['https://pbs.twimg.com/media/EqcjvbMXEAA7rHH.jpg', 'https://pbs.twimg.com/media/EqcjvbMXcAABB9M.jpg']",99,645,3331,['breonnataylor'],[],https://twitter.com/AttorneyCrump/status/1344082313928445954,False,,1,https://pbs.twimg.com/media/EqcjvbMXEAA7rHH.jpg,,,,,,,[],,,,
0,1344743127102459921,1344743127102459904,2020-12-31 21:32:00 ora solare Europa occidentale,2020-12-31,21:32:00,200,151967576,attorneycrump,Ben Crump,,What a disappointment and a DISGRACE. @TheJusticeDept has decided not to charge officers Timothy Loehmann &amp; Frank Garmback for the killing of #TamirRice. He was an INNOCENT CHILD who was treated like a criminal at first glance and robbed of his young life.  https://t.co/Mgz9Wgfvux,en,"[{'screen_name': 'thejusticedept', 'name': 'justice department', 'id': '73181712'}]",['https://www.npr.org/2020/12/29/951277146/justice-department-declines-to-prosecute-cleveland-officers-who-killed-tamir-ric'],[],83,369,1320,['tamirrice'],[],https://twitter.com/AttorneyCrump/status/1344743127102459921,False,,0,,,,,,,,[],,,,
1,1344730543980761092,1344730543980761088,2020-12-31 20:42:00 ora solare Europa occidentale,2020-12-31,20:42:00,200,151967576,attorneycrump,Ben Crump,,Kudos to @MayoClinic for embracing the reality of unequal treatment of POC in healthcare! The clinic is assisting Black churches &amp; community medical centers in closing the healthcare gap &amp; improve the COVID-19 pandemic outlook in Black communities. ✊🏾 https://t.co/kqJ48dbkL2,en,"[{'screen_name': 'mayoclinic', 'name': 'mayo clinic', 'id': '14592723'}]",['https://www.12news.com/article/news/nation-world/improve-covid-pandemic-outlook-black-communities/507-9d3dd2e6-1411-42bc-b9ac-13e4eaf55cbd'],[],3,54,274,[],[],https://twitter.com/AttorneyCrump/status/1344730543980761092,False,,0,,,,,,,,[],,,,
2,1344712397240590339,1344712397240590336,2020-12-31 19:29:53 ora solare Europa occidentale,2020-12-31,19:29:53,200,151967576,attorneycrump,Ben Crump,,"#AndreHill shared this positive message just last year. Andre was a happy man who loved his family &amp; his LIFE. He should be alive today... As we reflect on the year that's ending, may we not forget the families who have lost their loved ones this tumultuous year.  https://t.co/ez297KNOsg",en,[],[],[],37,189,878,['andrehill'],[],https://twitter.com/AttorneyCrump/status/1344712397240590339,False,,1,https://pbs.twimg.com/amplify_video_thumb/1344712065416622080/img/qavGR6m8sr24mDwk.jpg,,,,,,,[],,,,
3,1344678451278729216,1344678451278729216,2020-12-31 17:15:00 ora solare Europa occidentale,2020-12-31,17:15:00,200,151967576,attorneycrump,Ben Crump,,"As this just-obtained bodycam footage clearly shows, @ColumbusPolice officers could have rendered medical aid to Andre Hill after shooting him. But 5 minutes and 11 seconds later, they chose to handcuff his dying body instead. Andre committed no crime! #JusticeForAndreHill  https://t.co/Fr7gflDPuM",en,"[{'screen_name': 'columbuspolice', 'name': 'columbus ohio police', 'id': '40010656'}]",[],[],123,556,1037,['justiceforandrehill'],[],https://twitter.com/AttorneyCrump/status/1344678451278729216,False,,1,https://pbs.twimg.com/amplify_video_thumb/1344673027972337664/img/ZVdLZlw414Nu1Qag.jpg,,,,,,,[],,,,
4,1344658418804658177,1344658415008833536,2020-12-31 15:55:24 ora solare Europa occidentale,2020-12-31,15:55:24,200,151967576,attorneycrump,Ben Crump,,But we must keep up the pressure! Sign our petition and tell DA Cy Vance we need charges filed against this woman who assaulted Keyon Harrold Jr. ASAP:  https://t.co/yVEOt0xs5h,en,[],['https://act.bencrump.com/a/keyon-harrold'],[],21,77,291,[],[],https://twitter.com/AttorneyCrump/status/1344658418804658177,False,,0,,,,,,,,[],,,,
5,1344658415008833537,1344658415008833536,2020-12-31 15:55:23 ora solare Europa occidentale,2020-12-31,15:55:23,200,151967576,attorneycrump,Ben Crump,,"Thanks @TheRevAl for arranging yesterday’s meeting between Manhattan DA Cy Vance, Keyon Harrold Jr’s parents and I to discuss next steps for getting justice. (entire video on IG)  https://t.co/MxgpyxFzAG",en,"[{'screen_name': 'thereval', 'name': 'reverend al sharpton', 'id': '42389136'}]",[],[],20,88,534,[],[],https://twitter.com/AttorneyCrump/status/1344658415008833537,False,,1,https://pbs.twimg.com/ext_tw_video_thumb/1344658184317915138/pu/img/v_jP1QQPREvlo0Rm.jpg,,,,,,,[],,,,
6,1344506767791841280,1344506766042816512,2020-12-31 05:52:47 ora solare Europa occidentale,2020-12-31,05:52:47,200,151967576,attorneycrump,Ben Crump,,Anyone with information about this woman’s whereabouts should call NYPD’s Crime Stoppers at 800-577-TIPS (8477) or DM @nypdtips. #JusticeForKeyon,en,"[{'screen_name': 'nypdtips', 'name': 'nypd crime stoppers', 'id': '1038208115525799936'}]",[],[],87,447,1292,['justiceforkeyon'],[],https://twitter.com/AttorneyCrump/status/1344506767791841280,False,,0,,,,,,,,[],,,,
7,1344506766042816513,1344506766042816512,2020-12-31 05:52:47 ora solare Europa occidentale,2020-12-31,05:52:47,200,151967576,attorneycrump,Ben Crump,,The @nypd needs our help identifying the woman who attacked Keyon Harrold Jr. after falsely accusing the innocent teen of stealing her phone. This newly released footage of the attack clearly shows her assaulting Keyon before she fled the hotel prior to police arriving on scene!  https://t.co/hVnqrEXyjo,en,"[{'screen_name': 'nypd', 'name': 'new york portal depot', 'id': '286955282'}]",[],[],694,4214,7984,[],[],https://twitter.com/AttorneyCrump/status/1344506766042816513,False,,1,https://pbs.twimg.com/ext_tw_video_thumb/1344506735378231297/pu/img/MvxmFZf-BlNaLVER.jpg,,,,,,,[],,,,
8,1344504051472465922,1344504051472465920,2020-12-31 05:42:00 ora solare Europa occidentale,2020-12-31,05:42:00,200,151967576,attorneycrump,Ben Crump,,A @BrevardSheriff deputy shot &amp; killed 16-year-old A.J. Crooms &amp; 18-year-old Sincere Pierce. The deputy INCORRECTLY suspected them of driving a stolen car and pulled the trigger before asking questions... Demand accountability for this deputy's reckless actions!! Sign Petition:,en,[],[],[],18,279,770,[],[],https://twitter.com/AttorneyCrump/status/1344504051472465922,False,,0,,,,,,,,[],,,,
9,1344482660547063812,1344482660547063808,2020-12-31 04:17:00 ora solare Europa occidentale,2020-12-31,04:17:00,200,151967576,attorneycrump,Ben Crump,,Black communities should not have to fight for access to pharmacies and medical care! Advocates are already considering the daunting reality that many Black communities in Chicago don’t have pharmacies or stores that are easily accessible.   https://t.co/y02MsW1fh4,en,[],['https://www.cnn.com/2020/12/24/us/pharmacy-deserts-covid-19-vaccine/index.html'],[],16,83,324,[],[],https://twitter.com/AttorneyCrump/status/1344482660547063812,False,,0,,,,,,,,[],,,,
10,1344459759617888259,1344459759617888256,2020-12-31 02:46:00 ora solare Europa occidentale,2020-12-31,02:46:00,200,151967576,attorneycrump,Ben Crump,,"The Amazon-owned Ring home security company sold families a defective product that cost their safety! Hackers threatened the families w/ racial slurs &amp; sexual harassment; Ring blamed the VICTIMS! If defective products have harmed you, tell me your story.   https://t.co/fnMqZd3A75",en,[],['https://atlantablackstar.com/2020/12/28/fifteen-families-sue-amazon-ring-over-hacked-devices-leading-to-racial-slurs-threats-and-sexual-harassment/'],[],5,169,435,[],[],https://twitter.com/AttorneyCrump/status/1344459759617888259,False,,0,,,,,,,,[],,,,
11,1344435821563305984,1344435821563305984,2020-12-31 01:10:52 ora solare Europa occidentale,2020-12-31,01:10:52,200,151967576,attorneycrump,Ben Crump,,"Former Ofc. Adam Coy killed #AndreHill. His partner, Ofc. Amy Detweiler, now confirms she did NOT consider Andre a threat and saw NO gun (he held a phone). Coy didn't even give Andre a chance to talk before he opened fire! What kind of policing is this??  https://t.co/PTlXXwkIdd",en,[],[],[],70,386,1244,['andrehill'],[],https://twitter.com/AttorneyCrump/status/1344435821563305984,False,,1,https://pbs.twimg.com/amplify_video_thumb/1344426783991586817/img/UJE09SfvVl2e6Nem.jpg,,,,,,,[],,,,
0,1345157104701607936,1345157104701607936,2021-01-02 00:57:00 ora solare Europa occidentale,2021-01-02,00:57:00,200,151967576,attorneycrump,Ben Crump,,"Racism runs through the veins of police culture and too many of its officers. Legislation, such as the George Floyd Justice in Policing Act, is VITAL to make lasting change and hold them accountable for their actions. Send a letter to your senator to support the act today:",en,[],[],[],23,250,1256,[],[],https://twitter.com/AttorneyCrump/status/1345157104701607936,False,,0,,,,,,,,[],,,,
