,id,conversation_id,created_at,date,time,timezone,user_id,username,name,place,tweet,language,mentions,urls,photos,replies_count,retweets_count,likes_count,hashtags,cashtags,link,retweet,quote_url,video,thumbnail,near,geo,source,user_rt_id,user_rt,retweet_id,reply_to,retweet_date,translate,trans_src,trans_dest
4,1410753592219377668,1410753592219377664,2021-07-02 02:14:01 ora legale Europa occidentale,2021-07-02,02:14:01,200,151967576,attorneycrump,Ben Crump,,"The Congressional Black Caucus is pushing Democratic leaders to vote on a proposal to update the 1965 Voting Rights Act. W/ states racing to adopt new voting restrictions, we URGENTLY need voting protections! Our right to vote is under attack &amp; we must ACT! https://t.co/ulYo0eCzWX",en,[],['https://fal.cn/3guCn'],[],11,74,325,[],[],https://twitter.com/AttorneyCrump/status/1410753592219377668,False,,0,,,,,,,,[],,,,
0,1411455464022368259,1411455464022368256,2021-07-04 00:43:00 ora legale Europa occidentale,2021-07-04,00:43:00,200,151967576,attorneycrump,Ben Crump,,"When Target closed its Mondawmin store in 2018, it took jobs, goods, &amp; community pride from a predominantly Black area. Billion-dollar corporations who really care about equity &amp; justice should invest &amp; create LONG-TERM solutions for Black communities.  https://t.co/kX21sm8Yxt",en,[],['https://www.nytimes.com/2021/06/30/business/target-baltimore-store-closings.html'],[],48,117,481,[],[],https://twitter.com/AttorneyCrump/status/1411455464022368259,False,,0,,,,,,,,[],,,,
1,1411417902000005122,1411417793384402944,2021-07-03 22:13:45 ora legale Europa occidentale,2021-07-03,22:13:45,200,151967576,attorneycrump,Ben Crump,,"During the traffic stop, Hunter exited his truck to place the bottle behind the rear tire of his vehicle to stop it from rolling into the deputy’s car. Then, without warning, Ofc. Davis shot and killed him. #JusticeForHunter",en,[],[],[],15,109,389,['justiceforhunter'],[],https://twitter.com/AttorneyCrump/status/1411417902000005122,False,,0,,,,,,,,[],,,,
2,1411417793384402948,1411417793384402944,2021-07-03 22:13:19 ora legale Europa occidentale,2021-07-03,22:13:19,200,151967576,attorneycrump,Ben Crump,,"This is Hunter Brittain’s uncle, Jesse Brittain. He’s holding a bright blue bottle of antifreeze — The same bottle that Hunter Brittain was holding while he was fatally shot three times by Lonoke County Sheriff deputy Michael Davis.  https://t.co/Arp0GtUFsj",en,[],[],['https://pbs.twimg.com/media/E5Zc28pXIAAc4va.jpg'],23,216,761,[],[],https://twitter.com/AttorneyCrump/status/1411417793384402948,False,,1,https://pbs.twimg.com/media/E5Zc28pXIAAc4va.jpg,,,,,,,[],,,,
3,1411375691896078338,1411375691896078336,2021-07-03 19:26:01 ora legale Europa occidentale,2021-07-03,19:26:01,200,151967576,attorneycrump,Ben Crump,,"YES! Portland’s Racial Equity Committee recommended changes to policing, such as creating an alternative response to mental health crises &amp; oversight for officers. This is a step in the RIGHT direction to facilitate trust between police &amp; citizens.  https://t.co/bvVEs3zsYP",en,[],['https://www.wmtw.com/article/portland-racial-equity-committee-recommends-oversight-changes-for-police-department/36905790'],[],10,52,279,[],[],https://twitter.com/AttorneyCrump/status/1411375691896078338,False,,0,,,,,,,,[],,,,
4,1411345738466881538,1411345738466881536,2021-07-03 17:27:00 ora legale Europa occidentale,2021-07-03,17:27:00,200,151967576,attorneycrump,Ben Crump,,Christian Hall’s family deserves transparency! It's been 185 days since @PAStatePolice fatally shot 19yo Christian during a mental health crisis &amp; his family has STILL not received any answers. Tell Col. Evanchick to release the 90min dash cam footage!,en,"[{'screen_name': 'pastatepolice', 'name': 'pa state police', 'id': '2535036504'}]",[],[],2,48,154,[],[],https://twitter.com/AttorneyCrump/status/1411345738466881538,False,,0,,,,,,,,[],,,,
5,1411327373304344576,1411327373304344576,2021-07-03 16:14:01 ora legale Europa occidentale,2021-07-03,16:14:01,200,151967576,attorneycrump,Ben Crump,,"LSU medical students Lauren Bagneris &amp; Heather Duplessis jumped into action when a fellow passenger overheated on a flight to Greece! They completed a history assessment, supplied her with food &amp; took her blood pressure! 👏🏾👏🏾   https://t.co/V6gdnj2oWc",en,[],['https://www.essence.com/lifestyle/black-women-med-school-students/'],[],11,126,916,[],[],https://twitter.com/AttorneyCrump/status/1411327373304344576,False,,0,,,,,,,,[],,,,
6,1411314766916771842,1411314719269531648,2021-07-03 15:23:56 ora legale Europa occidentale,2021-07-03,15:23:56,200,151967576,attorneycrump,Ben Crump,,"I stand behind Sha’Carri and if she is denied an opportunity to compete in the Olympics, I can think of several legal challenges that should be brought in court immediately.",en,[],[],[],74,225,2190,[],[],https://twitter.com/AttorneyCrump/status/1411314766916771842,False,,0,,,,,,,,[],,,,
7,1411314719269531652,1411314719269531648,2021-07-03 15:23:44 ora legale Europa occidentale,2021-07-03,15:23:44,200,151967576,attorneycrump,Ben Crump,,Sha’Carri Richardson should be allowed to compete in the Olympic Trials and the Olympics. Anything less is an injustice. Marijuana is NOT a performance-enhancing drug and it’s legal in her state.,en,[],[],[],341,1461,10312,[],[],https://twitter.com/AttorneyCrump/status/1411314719269531652,False,,0,,,,,,,,[],,,,
8,1411153475367587842,1411153475367587840,2021-07-03 04:43:01 ora legale Europa occidentale,2021-07-03,04:43:01,200,151967576,attorneycrump,Ben Crump,,"The #BlackExcellence during the US Olympic Trials was undeniable!! Here are 5 Black athletes to watch out for in Tokyo. Congrats, everyone!! 👏🏾   https://t.co/cCV3NbMIDF",en,[],['https://fal.cn/3gw59'],[],11,75,520,['blackexcellence'],[],https://twitter.com/AttorneyCrump/status/1411153475367587842,False,,0,,,,,,,,[],,,,
0,1411823137759576069,1411823137759576064,2021-07-05 01:04:01 ora legale Europa occidentale,2021-07-05,01:04:01,200,151967576,attorneycrump,Ben Crump,,"Attacks against minorities greatly increased in CA in 2020. In a year fueled by stereotypes blaming Asians for COVID-19, hate crimes against Asian Americans more than doubled. We must END this epidemic of hate for the safety of all marginalized communities! https://t.co/C3Tj45RyMP",en,[],['https://fal.cn/3gxi3'],[],14,70,254,[],[],https://twitter.com/AttorneyCrump/status/1411823137759576069,False,,0,,,,,,,,[],,,,
1,1411789915055177737,1411789915055177728,2021-07-04 22:52:00 ora legale Europa occidentale,2021-07-04,22:52:00,200,151967576,attorneycrump,Ben Crump,,"School resource officers are supposed to protect children… So why did Deputy Fournier brutally body-slam 16yo Taylor Bracey into the hard concrete floor, knocking her unconscious AND handcuffing her? There’s no excuse for this behavior. Dep. Fournier must be held accountable:",en,[],[],[],92,690,2554,[],[],https://twitter.com/AttorneyCrump/status/1411789915055177737,False,,0,,,,,,,,[],,,,
2,1411742146546356228,1411742146546356224,2021-07-04 19:42:11 ora legale Europa occidentale,2021-07-04,19:42:11,200,151967576,attorneycrump,Ben Crump,,WOW! Salute to Eliot Middleton for helping to change SC residents lives by providing refurbished cars to families in need!  https://t.co/clIX6bErSX,en,[],[],[],35,264,963,[],[],https://twitter.com/AttorneyCrump/status/1411742146546356228,False,,1,https://pbs.twimg.com/amplify_video_thumb/1411741775006421001/img/tATU7MEh_ua9ILJ5.jpg,,,,,,,[],,,,
3,1411704605487022088,1411704605487022080,2021-07-04 17:13:00 ora legale Europa occidentale,2021-07-04,17:13:00,200,151967576,attorneycrump,Ben Crump,,The correctional telecom sector generates $1.4 BILLION annually in phone call revenue … w/ women &amp; POC disproportionately paying the price! This high price of phone calls is EXPLOITATIVE &amp; drives family members into debt.  https://t.co/IRdQSMI1Vy,en,[],['https://www.businessinsider.com/high-cost-prison-communications-driving-debt-racial-wealth-gap-2021-6'],[],48,236,765,[],[],https://twitter.com/AttorneyCrump/status/1411704605487022088,False,,0,,,,,,,,[],,,,
4,1411678179001995264,1411678179001995264,2021-07-04 15:28:00 ora legale Europa occidentale,2021-07-04,15:28:00,200,151967576,attorneycrump,Ben Crump,,"What does the 4th of July mean to you? Fredrick Douglass recited a poignant speech addressing the disparity of natural justice &amp; freedom in 1852. 160+ years later, his words still ring true for many Black Americans. Thanks @NPR for putting together this powerful recitation.  https://t.co/8lQbrX8XNk",en,"[{'screen_name': 'npr', 'name': 'npr', 'id': '5392522'}]",[],[],30,449,1139,[],[],https://twitter.com/AttorneyCrump/status/1411678179001995264,False,,1,https://pbs.twimg.com/amplify_video_thumb/1411024663812116484/img/vXWEw3vFhQvdY2KF.jpg,,,,,,,[],,,,
0,1412174952254492672,1412174952254492672,2021-07-06 00:22:00 ora legale Europa occidentale,2021-07-06,00:22:00,200,151967576,attorneycrump,Ben Crump,,There are only 10 days left to apply for the @BenCrumpLaw Community Leadership Scholarship. We hope to help the impassioned leaders of tomorrow achieve their goals of leading communities toward a better future. Apply today!,en,"[{'screen_name': 'bencrumplaw', 'name': 'ben crump law, pllc', 'id': '877341770081808385'}]",[],[],11,72,116,[],[],https://twitter.com/AttorneyCrump/status/1412174952254492672,False,,0,,,,,,,,[],,,,
1,1412120845732880385,1412120845732880384,2021-07-05 20:47:00 ora legale Europa occidentale,2021-07-05,20:47:00,200,151967576,attorneycrump,Ben Crump,,Racial disparities in health care are causing more of our Black queens to die! Black women with invasive breast cancer are 2x as likely to die compared to white counterparts. This is unacceptable. All women deserve high-quality care. We must close the survival gap!,en,[],[],[],13,126,446,[],[],https://twitter.com/AttorneyCrump/status/1412120845732880385,False,,0,,,,,,,,[],,,,
2,1412092408511217664,1412092408511217664,2021-07-05 18:54:00 ora legale Europa occidentale,2021-07-05,18:54:00,200,151967576,attorneycrump,Ben Crump,,A minor traffic stop should NOT have resulted in a fatal shooting at a point-blank range … Daunte Wright’s killing was NO mistake. It was an intentional and unacceptable use of force. Demand Officer Kim Potter be held accountable:,en,[],[],[],86,802,4458,[],[],https://twitter.com/AttorneyCrump/status/1412092408511217664,False,,0,,,,,,,,[],,,,
3,1412066242194808833,1412066242194808832,2021-07-05 17:10:01 ora legale Europa occidentale,2021-07-05,17:10:01,200,151967576,attorneycrump,Ben Crump,,WOW! Decades of intimidation from corporations to push scientists to approve potentially harmful pesticides led to the creation of products containing cancer-causing agents used by INNOCENT consumers! We need broader regulation of consumer products!   https://t.co/VbfTpPDH2q,en,[],['https://fal.cn/3gyjR'],[],9,94,297,[],[],https://twitter.com/AttorneyCrump/status/1412066242194808833,False,,0,,,,,,,,[],,,,
0,1412887147854630917,1412887147854630912,2021-07-07 23:32:00 ora legale Europa occidentale,2021-07-07,23:32:00,200,151967576,attorneycrump,Ben Crump,,"Yesterday, Minneapolis PD took the life of ANOTHER innocent Black man. While chasing a carjacking &amp; robbery suspect, they crashed into Leneal Frazier, Darnella Frazier’s uncle &amp; a father of 5. This gross neglect for public safety is unacceptable!  https://t.co/zkDIecmzJ8",en,[],['https://minnesota.cbslocal.com/2021/07/06/1-killed-in-crash-involving-minneapolis-police-car/'],[],33,222,656,[],[],https://twitter.com/AttorneyCrump/status/1412887147854630917,False,,0,,,,,,,,[],,,,
1,1412859423299719172,1412859423299719168,2021-07-07 21:41:50 ora legale Europa occidentale,2021-07-07,21:41:50,200,151967576,attorneycrump,Ben Crump,,FL Gov. DeSantis vetoed a juvenile arrest bill that would allow minors to complete a behavioral program to expunge criminal records &amp; give them greater access to employment &amp; education. Our youth should have the opportunity for a second chance at life!   https://t.co/xND4BcWR8o,en,[],['https://www.miamiherald.com/news/politics-government/state-politics/article252467883.html'],[],157,519,1620,[],[],https://twitter.com/AttorneyCrump/status/1412859423299719172,False,,0,,,,,,,,[],,,,
2,1412800826477789189,1412800826477789184,2021-07-07 17:49:00 ora legale Europa occidentale,2021-07-07,17:49:00,200,151967576,attorneycrump,Ben Crump,,"Hunter Brittain had hopes and dreams. His life was unjustly cut short during a traffic stop when Sgt. Michael Davis opened fire, killing him. We will continue to fight for justice and accountability in policing and demand answers about what happened to Hunter!  https://t.co/ZzE1XQrvUQ",en,[],[],[],31,229,656,[],[],https://twitter.com/AttorneyCrump/status/1412800826477789189,False,,1,https://pbs.twimg.com/media/E5ssb4zWEAcWZtQ.jpg,,,,,,,[],,,,
3,1412764845632540672,1412764845632540672,2021-07-07 15:26:01 ora legale Europa occidentale,2021-07-07,15:26:01,200,151967576,attorneycrump,Ben Crump,,"65yo grandmother Twyanna Williams graduated as valedictorian of her South Philadelphia HS class after years of putting off her dreams of earning her diploma due to financial reasons. Congrats, Twyanna for achieving your goals &amp; inspiring us all! 👏🏾   https://t.co/vjubNgXk4u",en,[],['https://www.blackenterprise.com/65-year-old-grandmother-graduates-from-high-school-as-class-valedictorian'],[],14,105,1060,[],[],https://twitter.com/AttorneyCrump/status/1412764845632540672,False,,0,,,,,,,,[],,,,
4,1412611076479283201,1412611076479283200,2021-07-07 05:15:00 ora legale Europa occidentale,2021-07-07,05:15:00,200,151967576,attorneycrump,Ben Crump,,"Ohio police chief Anthony Campo RETIRED after video captured him placing a piece of paper that read “Ku Klux Klan” &amp; a yellow robe on the desk of a Black officer. When Sheffield Mayor visited Campo, he reportedly thought the incident was a joke before he resigned!",en,[],[],[],168,508,1232,[],[],https://twitter.com/AttorneyCrump/status/1412611076479283201,False,,0,,,,,,,,[],,,,
5,1412594218497937411,1412594218497937408,2021-07-07 04:08:01 ora legale Europa occidentale,2021-07-07,04:08:01,200,151967576,attorneycrump,Ben Crump,,"Hunter Brittain should still be alive! He was a HS senior who should be preparing to go to prom… instead we attended his memorial service because he was fatally shot by Lonoke County Sgt. Micheal Davis! Rest In Power, Hunter!  https://t.co/PBLwPmxkJN",en,[],['https://www.nwaonline.com/news/2021/jul/06/al-sharpton-eulogize-arkansas-teen-fatally-shot-de/'],[],16,108,404,[],[],https://twitter.com/AttorneyCrump/status/1412594218497937411,False,,0,,,,,,,,[],,,,
6,1412562298791661568,1412562298791661568,2021-07-07 02:01:10 ora legale Europa occidentale,2021-07-07,02:01:10,200,151967576,attorneycrump,Ben Crump,,Former Metro Police Officer Andrew Delke will only serve 3 YEARS after the Davidson County DA’s Office offered him a plea deal for fatally shooting Daniel Hambrick!   #TwoAmericas  https://t.co/soUf8vtO2U,en,[],[],['https://pbs.twimg.com/media/E5pt7GzXwAEVCPD.jpg'],64,264,498,['twoamericas'],[],https://twitter.com/AttorneyCrump/status/1412562298791661568,False,,1,https://pbs.twimg.com/media/E5pt7GzXwAEVCPD.jpg,,,,,,,[],,,,
0,1414710157444014080,1414710157444014080,2021-07-13 00:16:00 ora legale Europa occidentale,2021-07-13,00:16:00,200,151967576,attorneycrump,Ben Crump,,East Cleveland officer Nicholas Foti will return to duty &amp; receive back pay after being fired for STOMPING on a man's head during a traffic stop. Ofc. Foti's actions violated East Cleveland PD's policy! He should not be rewarded for his unjustified use of force!  https://t.co/Kn6LKJDWz6,en,[],[],[],131,711,1334,[],[],https://twitter.com/AttorneyCrump/status/1414710157444014080,False,,1,https://pbs.twimg.com/media/E6H5jWHX0AIoFq5.jpg,,,,,,,[],,,,
1,1414657560909594626,1414657560909594624,2021-07-12 20:47:00 ora legale Europa occidentale,2021-07-12,20:47:00,200,151967576,attorneycrump,Ben Crump,,"Southwest Value Partners refused to allow DoveCote, LLC, an upscale events company, to host events attended by POC at their properties, yet they permit larger events with primarily non-minority attendants. It’s 2021. This blatant discrimination is absolutely unacceptable!  https://t.co/UHoU69s5dA",en,[],[],[],14,77,271,[],[],https://twitter.com/AttorneyCrump/status/1414657560909594626,False,,1,https://pbs.twimg.com/media/E6HHh1GWEAYcNQy.jpg,,,,,,,[],,,,
2,1414640448254193670,1414640448254193664,2021-07-12 19:39:00 ora legale Europa occidentale,2021-07-12,19:39:00,200,151967576,attorneycrump,Ben Crump,,"94yo Martha Tucker always wanted to try on a wedding dress, but when she got married in 1952, Black women weren't allowed in bridal shops. Thankfully, her granddaughters weren’t going to let Martha’s dream slip away. What a beautiful moment &amp; a beautiful bride!  https://t.co/HEWBq7iFnl",en,[],[],[],52,313,1931,[],[],https://twitter.com/AttorneyCrump/status/1414640448254193670,False,,1,https://pbs.twimg.com/amplify_video_thumb/1414625778461982720/img/nwTbxKkNtX09XkvO.jpg,,,,,,,[],,,,
3,1414574513770041345,1414574513770041344,2021-07-12 15:17:00 ora legale Europa occidentale,2021-07-12,15:17:00,200,151967576,attorneycrump,Ben Crump,,"At Gopher Resource, clouds of lead loom over workers. It is next to impossible for these worker not to contaminate their families. Many children have highly elevated levels of lead in their bloodstream due to parents accidentally tracking it home. Demand Accountability:",en,[],[],[],8,62,170,[],[],https://twitter.com/AttorneyCrump/status/1414574513770041345,False,,0,,,,,,,,[],,,,
0,1415082112563154945,1415082112563154944,2021-07-14 00:54:01 ora legale Europa occidentale,2021-07-14,00:54:01,200,151967576,attorneycrump,Ben Crump,,"America’s lack of police reform affects us all, as showcased by the unjust killing of Hunter Brittain at the hands of a Lonoke County sheriff’s deputy! People are being brutalized &amp; killed… We demand REAL change in policing for the safety of our children.  https://t.co/7MGDZdkgs3",en,[],['https://www.cnn.com/2021/07/12/us/hunter-brittain-sharpton-crump/index.html'],[],23,93,417,[],[],https://twitter.com/AttorneyCrump/status/1415082112563154945,False,,0,,,,,,,,[],,,,
1,1415047643785539595,1415047643785539584,2021-07-13 22:37:03 ora legale Europa occidentale,2021-07-13,22:37:03,200,151967576,attorneycrump,Ben Crump,,"Today would have been Frederick Cox’s 19th birthday! Unfortunately, a Davidson County Sheriffs Office deputy in plain clothes fatally shot Fred as he ushered people to safety during a shooting at a funeral. Fred Cox was a HERO! RestInPower!  https://t.co/KFjQofTwTG",en,[],[],['https://pbs.twimg.com/media/E6NCVGzXoAEXRnz.jpg'],19,167,654,[],[],https://twitter.com/AttorneyCrump/status/1415047643785539595,False,,1,https://pbs.twimg.com/media/E6NCVGzXoAEXRnz.jpg,,,,,,,[],,,,
2,1415010642935885828,1415010642935885824,2021-07-13 20:10:01 ora legale Europa occidentale,2021-07-13,20:10:01,200,151967576,attorneycrump,Ben Crump,,"On Saturday, @SDAAMFA unveiled “Say Their Names,” a memorial containing 200 photos of Black people who lost their lives due to racial injustice. Our elected officials should honor them by advocating for policy to prevent any more unjust deaths!  https://t.co/BRwpfCwUuy",en,"[{'screen_name': 'sdaamfa', 'name': 'sdaamfa', 'id': '2277922158'}]",['https://www.10news.com/community/stories-for-change/sd-african-american-museum-of-fine-art-unveils-say-their-names-memorial'],[],6,59,265,[],[],https://twitter.com/AttorneyCrump/status/1415010642935885828,False,,0,,,,,,,,[],,,,
3,1414962070722957328,1414962070722957312,2021-07-13 16:57:01 ora legale Europa occidentale,2021-07-13,16:57:01,200,151967576,attorneycrump,Ben Crump,,"Photographer Dawoud Bey’s newest exhibition, “Dawoud Bey: An American Project,” beautifully captures the unique complexities of Black life while representing the historical racial &amp; economic disparities we face. On display now @whitneymuseum in NYC.  https://t.co/1RP833HyAa",en,"[{'screen_name': 'whitneymuseum', 'name': 'whitney museum', 'id': '16517711'}]",['https://www.nbcnews.com/news/nbcblk/photographer-dawoud-beys-work-captures-black-love-pride-history-rcna1308'],[],4,33,125,[],[],https://twitter.com/AttorneyCrump/status/1414962070722957328,False,,0,,,,,,,,[],,,,
4,1414829162225864705,1414829162225864704,2021-07-13 08:08:53 ora legale Europa occidentale,2021-07-13,08:08:53,200,151967576,attorneycrump,Ben Crump,,"Kevin Strickland case: Public, official comments show divide on guilt or innocence  https://t.co/rWnM8Z8TR9 #FreeKevinStrickland",en,[],['https://www.kansascity.com/news/local/crime/article252674868.html'],[],4,9,21,['freekevinstrickland'],[],https://twitter.com/AttorneyCrump/status/1414829162225864705,False,,0,,,,,,,,[],,,,
5,1414772568645677059,1414772568645677056,2021-07-13 04:24:00 ora legale Europa occidentale,2021-07-13,04:24:00,200,151967576,attorneycrump,Ben Crump,,DeWitt PD officer Rory Spain has been placed on paid administrative leave after violently punching a handcuffed Tyreana Edmonds in Walmart. Ofc. Spain chose to inflict further chaos &amp; forego his police training rather than de-escalating the situation!  https://t.co/pZFczXAAaV,en,[],[],[],520,1045,2316,[],[],https://twitter.com/AttorneyCrump/status/1414772568645677059,False,,1,https://pbs.twimg.com/amplify_video_thumb/1414682396469911562/img/NhIU_9gO4oV8UM1Q.jpg,,,,,,,[],,,,
0,1415804369501671430,1415804369501671424,2021-07-16 00:44:00 ora legale Europa occidentale,2021-07-16,00:44:00,200,151967576,attorneycrump,Ben Crump,,The family of Andrew Brown Jr. has filed a $30 million civil rights lawsuit in the fatal shooting of Andrew Brown Jr. He was unjustly killed by NC sheriff deputies as he drove away from police! We will continue to demand accountability for Andrew's death!  https://t.co/aW1ojLjlFA,en,[],['https://www.wgal.com/article/family-files-dollar30-million-civil-rights-suit-over-andrew-brown-jr-shooting/37026944'],[],16,74,336,[],[],https://twitter.com/AttorneyCrump/status/1415804369501671430,False,,0,,,,,,,,[],,,,
1,1415781214833754116,1415781214833754112,2021-07-15 23:12:00 ora legale Europa occidentale,2021-07-15,23:12:00,200,151967576,attorneycrump,Ben Crump,,FL’s anti-riot law hasn’t been enforced on other protestors who block intersections as they flock to the streets in protest. It’s CLEAR that it was passed last year to kill the 1st amendment rights of Black people during George Floyd demonstrations! This is hypocrisy!  https://t.co/SxYwkMSYCU,en,[],[],[],44,292,826,[],[],https://twitter.com/AttorneyCrump/status/1415781214833754116,False,,1,https://pbs.twimg.com/amplify_video_thumb/1415759252833120258/img/1MwrdCfZjZsdaR8X.jpg,,,,,,,[],,,,
2,1415713772430319629,1415713772430319616,2021-07-15 18:44:00 ora legale Europa occidentale,2021-07-15,18:44:00,200,151967576,attorneycrump,Ben Crump,,"Disappointed, but not surprised… Researchers revealed that officers’ tones were significantly less friendly to Black male drivers than white male drivers during traffic stops. This behavior further showcases why we MUST change the culture of policing!   https://t.co/ab1ovvxFmi",en,[],['https://mashable.com/article/black-drivers-police-interactions'],[],31,183,590,[],[],https://twitter.com/AttorneyCrump/status/1415713772430319629,False,,0,,,,,,,,[],,,,
3,1415499862825750528,1415499862825750528,2021-07-15 04:34:00 ora legale Europa occidentale,2021-07-15,04:34:00,200,151967576,attorneycrump,Ben Crump,,"After England’s soccer team’s defeat against Italy, many Black players were bombarded w/ racist social media comments! These attacks are shameful! Soccer players are more than just athletes—they’re HUMAN &amp; they deserve to be treated w/ respect!  https://t.co/jOR5tJNRP9",en,[],['https://www.nytimes.com/2021/07/12/world/europe/england-european-championships-racism.html'],[],16,74,441,[],[],https://twitter.com/AttorneyCrump/status/1415499862825750528,False,,0,,,,,,,,[],,,,
4,1415478752583290888,1415478752583290880,2021-07-15 03:10:07 ora legale Europa occidentale,2021-07-15,03:10:07,200,151967576,attorneycrump,Ben Crump,,"Once again, our people are being subjected to unjust racial profiling &amp; harassment over a CELLPHONE! She didn’t even have the common decency to apologize for her FALSE accusation! This behavior is disgusting &amp; incredibly dangerous!!  https://t.co/YuwSdooTnD",en,[],[],[],946,3010,8368,[],[],https://twitter.com/AttorneyCrump/status/1415478752583290888,False,,1,https://pbs.twimg.com/amplify_video_thumb/1415477502747811841/img/WcDvZ6OVPSmsF0cU.jpg,,,,,,,[],,,,
5,1415472183405596678,1415472183405596672,2021-07-15 02:44:01 ora legale Europa occidentale,2021-07-15,02:44:01,200,151967576,attorneycrump,Ben Crump,,The erasure of Black southern activists from history promotes a dangerous and FALSE narrative. The TRUTH is we’ve never surrendered to institutionalized racism &amp; we won’t start now! Our children deserve to learn the WHOLE truth!  https://t.co/JXTmXlWJLd,en,[],['https://www.washingtonpost.com/outlook/2021/07/14/conservatives-are-once-again-trying-erase-black-history/'],[],10,116,463,[],[],https://twitter.com/AttorneyCrump/status/1415472183405596678,False,,0,,,,,,,,[],,,,
