,id,conversation_id,created_at,date,time,timezone,user_id,username,name,place,tweet,language,mentions,urls,photos,replies_count,retweets_count,likes_count,hashtags,cashtags,link,retweet,quote_url,video,thumbnail,near,geo,source,user_rt_id,user_rt,retweet_id,reply_to,retweet_date,translate,trans_src,trans_dest
5,1375272800580145152,1375272800580145152,2021-03-26 03:26:01 ora solare Europa occidentale,2021-03-26,03:26:01,200,151967576,attorneycrump,Ben Crump,,GA state troopers ARRESTED State Rep. Park Cannon for knocking on @GovKemp’s door as he signed a huge voter suppression bill! She did her JOB as an elected official &amp; they forcibly dragged her through the GA Capitol &amp; into a police car! #WhatYearIsThis #JimCrowV2 🎥/@TWareStevens  https://t.co/UWHeyO7br8,en,"[{'screen_name': 'govkemp', 'name': 'governor brian p. kemp', 'id': '1064659902071808000'}, {'screen_name': 'twarestevens', 'name': 'tamara stevens', 'id': '3116704642'}]",[],[],281,1368,2815,"['whatyearisthis', 'jimcrowv2']",[],https://twitter.com/AttorneyCrump/status/1375272800580145152,False,,1,https://pbs.twimg.com/ext_tw_video_thumb/1375272527799451650/pu/img/JCLIlBV2VhldBgV6.jpg,,,,,,,[],,,,
6,1375256441808912386,1375256441808912384,2021-03-26 02:21:01 ora solare Europa occidentale,2021-03-26,02:21:01,200,151967576,attorneycrump,Ben Crump,,Good to see Jay Leno apologize for perpetuating stereotypes against Asian Americans. This is a step in the right direction but our country still needs to fix the CENTURIES of ignorant behavior that led to the discrimination against all minorities!   https://t.co/cZuCF451KH,en,[],['https://variety.com/2021/tv/news/jay-leno-asian-jokes-apology-manaa-nbc-fox-1234937201/'],[],6,49,339,[],[],https://twitter.com/AttorneyCrump/status/1375256441808912386,False,,0,,,,,,,,[],,,,
0,1375938937106096131,1375938937106096128,2021-03-27 23:33:00 ora solare Europa occidentale,2021-03-27,23:33:00,200,151967576,attorneycrump,Ben Crump,,"Deputy Santiago-Miranda discharged 10 BULLETS into the car of AJ Crooms &amp; Sincere Pierce, killing the 2 Black teens. The state attorney has held up this investigation for 7 WEEKS &amp; refuses to talk with the boys' parents. Justice delayed is justice DENIED!  https://t.co/K0WeUy1TFm",en,[],['https://fal.cn/3ejCI'],[],13,254,561,[],[],https://twitter.com/AttorneyCrump/status/1375938937106096131,False,,0,,,,,,,,[],,,,
1,1375893389611302919,1375893389611302912,2021-03-27 20:32:01 ora solare Europa occidentale,2021-03-27,20:32:01,200,151967576,attorneycrump,Ben Crump,,"The tax code is RIGGED against Black working families! On average, they pay higher taxes than comparable-earning white couples with sole breadwinners. This impacts families NOW and in the FUTURE as we build generational wealth. We must demand change!   https://t.co/DCaLByPgju",en,[],['https://fal.cn/3ejA4'],[],12,94,276,[],[],https://twitter.com/AttorneyCrump/status/1375893389611302919,False,,0,,,,,,,,[],,,,
2,1375867966407929857,1375867966407929856,2021-03-27 18:51:00 ora solare Europa occidentale,2021-03-27,18:51:00,200,151967576,attorneycrump,Ben Crump,,"The “shoot now, think later” mentality of @HoustonPolice led to a bullet in the head of 1yo Legend Smalls! He miraculously survived, but is now on a ventilator and his life may never be the same. Demand justice for Little Legend:",en,"[{'screen_name': 'houstonpolice', 'name': 'houston police', 'id': '104691452'}]",[],[],56,581,1825,[],[],https://twitter.com/AttorneyCrump/status/1375867966407929857,False,,0,,,,,,,,[],,,,
3,1375854630148669446,1375854530785607680,2021-03-27 17:58:00 ora solare Europa occidentale,2021-03-27,17:58:00,200,151967576,attorneycrump,Ben Crump,,Watch new documentary “Woman In Motion” today:  https://t.co/HoJAtb4l8M,en,[],['https://itunes.apple.com/us/movie/woman-in-motion-nichelle-nichols-star-trek-remaking/id1549804941'],[],2,18,51,[],[],https://twitter.com/AttorneyCrump/status/1375854630148669446,False,,0,,,,,,,,[],,,,
4,1375831984723857416,1375831984723857408,2021-03-27 16:28:01 ora solare Europa occidentale,2021-03-27,16:28:01,200,151967576,attorneycrump,Ben Crump,,"Freedom didn't just happen. From repealing discriminatory laws to funding education for all students, Black activists spent DECADES fighting for equality pre-Civil War! Never forget where we came from! ✊🏾 #BlackHistory  https://t.co/1nkziAO3CE",en,[],['https://fal.cn/3ejss'],[],5,90,294,['blackhistory'],[],https://twitter.com/AttorneyCrump/status/1375831984723857416,False,,0,,,,,,,,[],,,,
5,1375796243859963908,1375796243859963904,2021-03-27 14:06:00 ora solare Europa occidentale,2021-03-27,14:06:00,200,151967576,attorneycrump,Ben Crump,,"Our future is BRIGHT w/ storytellers like 14yo Kalia Love Jones! Inspired by @MichelleObama, she wrote/directed “The Power of Hope” — reminding us that w/ resilience &amp; dedication, we can overcome life’s obstacles. Congrats Kalia on your @NAACP Image Award nomination!  https://t.co/uQhOpUYu2G",en,"[{'screen_name': 'michelleobama', 'name': 'michelle obama', 'id': '409486555'}, {'screen_name': 'naacp', 'name': 'naacp', 'id': '44988185'}]",[],[],7,49,140,[],[],https://twitter.com/AttorneyCrump/status/1375796243859963908,False,,1,https://pbs.twimg.com/media/ExbjeWDWQAMOzpe.jpg,,,,,,,[],,,,
6,1375640467262476291,1375640467262476288,2021-03-27 03:47:00 ora solare Europa occidentale,2021-03-27,03:47:00,200,151967576,attorneycrump,Ben Crump,,"Marion Humphrey, a law student, was detained &amp; MOCKED for over an hour while @ARStatePolice troopers ransacked his U-Haul! Troopers used RACIST stereotypes to conclude that he was carrying drugs yet found NOTHING! This is just another disgusting instance of #DrivingWhileBlack!  https://t.co/rXK3qRIew1",en,[],[],[],248,1164,2717,['drivingwhileblack'],[],https://twitter.com/AttorneyCrump/status/1375640467262476291,False,,1,https://pbs.twimg.com/amplify_video_thumb/1375200201464557574/img/3KaPy89HVuRzAGtV.jpg,,,,,,,[],,,,
0,1376296037279666177,1376296037279666176,2021-03-29 00:12:00 ora legale Europa occidentale,2021-03-29,00:12:00,200,151967576,attorneycrump,Ben Crump,,"Kenosha Police shot Jacob Blake in the BACK multiple times, leaving him paralyzed. We have filed a lawsuit against the officer, but still need your help! Sign petition and demand justice for Jacob Blake:",en,[],[],[],41,319,1040,[],[],https://twitter.com/AttorneyCrump/status/1376296037279666177,False,,0,,,,,,,,[],,,,
1,1376280499077984256,1376280499077984256,2021-03-28 23:10:15 ora legale Europa occidentale,2021-03-28,23:10:15,200,151967576,attorneycrump,Ben Crump,,"We MUST rally against avoidable violence &amp; brutality that killed George Floyd at the hands of police! Join @TheRevAl, the family of George Floyd, and I TODAY (3/28) for a prayer vigil to remember and honor George's legacy. 🙏🏾 #ChauvinTrial  https://t.co/VedzuODfkF",en,"[{'screen_name': 'thereval', 'name': 'reverend al sharpton', 'id': '42389136'}]",[],['https://pbs.twimg.com/media/ExmH0Z3XAAU139b.jpg'],13,61,266,['chauvintrial'],[],https://twitter.com/AttorneyCrump/status/1376280499077984256,False,,1,https://pbs.twimg.com/media/ExmH0Z3XAAU139b.jpg,,,,,,,[],,,,
2,1376193365914628104,1376193365914628096,2021-03-28 17:24:01 ora legale Europa occidentale,2021-03-28,17:24:01,200,151967576,attorneycrump,Ben Crump,,"Being a Black parent is HARD. Just ask the parents of Keyon Harrold Jr, Legend Smalls, Taylor Bracey, &amp; many others. Stereotypes &amp; violence directed at children of color is exhausting, but is exactly why we must keep up this fight! Our kids deserve better!  https://t.co/kz7wVvCc9k",en,[],['https://fal.cn/3ek3l'],[],13,88,406,[],[],https://twitter.com/AttorneyCrump/status/1376193365914628104,False,,0,,,,,,,,[],,,,
3,1376172473222320128,1376172473222320128,2021-03-28 16:01:00 ora legale Europa occidentale,2021-03-28,16:01:00,200,151967576,attorneycrump,Ben Crump,,Ingrid Nathan was the 1st Black student to integrate Seminole County Schools. Watching her recount the experience is a reminder that the civil rights movement of the 60s didn't happen long ago. We've made great strides in the pursuit of equality but still have a long way to go!  https://t.co/01RrdvlCJD,en,[],[],[],14,111,380,[],[],https://twitter.com/AttorneyCrump/status/1376172473222320128,False,,1,https://pbs.twimg.com/amplify_video_thumb/1375528422802329600/img/PXlmb42vO7nymo_R.jpg,,,,,,,[],,,,
0,1376679827701436419,1376679827701436416,2021-03-30 01:37:03 ora legale Europa occidentale,2021-03-30,01:37:03,200,151967576,attorneycrump,Ben Crump,,8 minutes and 46 seconds. The amount of time we kneeled in honor of George Floyd today. Let this serve as a reminder to America just how long Derek Chauvin tortured George Floyd.  https://t.co/IJG1mF0lGi,en,[],[],['https://pbs.twimg.com/media/ExrzAatWYAYIVlb.jpg'],92,594,3491,[],[],https://twitter.com/AttorneyCrump/status/1376679827701436419,False,,1,https://pbs.twimg.com/media/ExrzAatWYAYIVlb.jpg,,,,,,,[],,,,
1,1376659664553844740,1376659664553844736,2021-03-30 00:16:55 ora legale Europa occidentale,2021-03-30,00:16:55,200,151967576,attorneycrump,Ben Crump,,Donald Williams testified today at the Derek Chauvin trial. I spoke with him last June about his first-hand account of George Floyd’s murder.  https://t.co/QHhX7PC4au,en,[],[],[],23,95,362,[],[],https://twitter.com/AttorneyCrump/status/1376659664553844740,False,,1,https://pbs.twimg.com/amplify_video_thumb/1376657422140518400/img/99kWXngYtdOYifJR.jpg,,,,,,,[],,,,
2,1376645151934844937,1376645151934844928,2021-03-29 23:19:15 ora legale Europa occidentale,2021-03-29,23:19:15,200,151967576,attorneycrump,Ben Crump,,"George Floyd is more than a HASHTAG! He was a living, breathing positive influence and left a loving mark on his community. Now he deserves JUSTICE! George's brother Philonise Floyd and I spoke with @GayleKing this morning about what to expect during the Derek Chauvin trial.  https://t.co/ND9yaIbbvd",en,"[{'screen_name': 'gayleking', 'name': 'gayle king', 'id': '29546945'}]",[],[],23,159,672,[],[],https://twitter.com/AttorneyCrump/status/1376645151934844937,False,,1,https://pbs.twimg.com/amplify_video_thumb/1376642343298809864/img/lTGHJ7korjlJTeQl.jpg,,,,,,,[],,,,
3,1376613588178206724,1376613588178206720,2021-03-29 21:13:50 ora legale Europa occidentale,2021-03-29,21:13:50,200,151967576,attorneycrump,Ben Crump,,We did it! A portion of Lamar St in Dallas was dedicated on Saturday as Botham Jean Blvd!! City leadership did the RIGHT thing by preserving Bo's legacy in the community that he loved so much. This will serve as a constant reminder of the bright future taken from us too soon. 🙏🏾  https://t.co/NYzJXWvJM7,en,[],[],[],13,97,537,[],[],https://twitter.com/AttorneyCrump/status/1376613588178206724,False,,1,https://pbs.twimg.com/amplify_video_thumb/1376606680474091524/img/GWgamHKov84gNsgS.jpg,,,,,,,[],,,,
4,1376523921508433924,1376523921508433920,2021-03-29 15:17:32 ora legale Europa occidentale,2021-03-29,15:17:32,200,151967576,attorneycrump,Ben Crump,,"This murder case is not hard! What killed #GeorgeFloyd was an overdose of excessive force, ""asphyxiation from sustained pressure"" of a knee to his neck for 8 minutes and 46 seconds. #DerekChauvinTrial",en,[],[],[],143,1050,4790,"['georgefloyd', 'derekchauvintrial']",[],https://twitter.com/AttorneyCrump/status/1376523921508433924,False,,0,,,,,,,,[],,,,
5,1376522177424547844,1376522177424547840,2021-03-29 15:10:36 ora legale Europa occidentale,2021-03-29,15:10:36,200,151967576,attorneycrump,Ben Crump,,"Everything you hear today will attempt to assassinate George Floyd’s character, but remember... this the trial of #DerekChauvin, not #GeorgeFloyd! #ChauvinTrial",en,[],[],[],490,4240,18570,"['derekchauvin', 'georgefloyd', 'chauvintrial']",[],https://twitter.com/AttorneyCrump/status/1376522177424547844,False,,0,,,,,,,,[],,,,
6,1376515231460040704,1376515231460040704,2021-03-29 14:43:00 ora legale Europa occidentale,2021-03-29,14:43:00,200,151967576,attorneycrump,Ben Crump,,"10 mos after George Floyd's death, opening statements are set to begin today in the Derek Chauvin trial. The Floyd family will be forced to endure images of Derek Chauvin’s knee on George’s neck &amp; see Chauvin’s menacing smirk on his face. Stand in Solidarity w/ the Floyd Family:",en,[],[],[],62,376,1618,[],[],https://twitter.com/AttorneyCrump/status/1376515231460040704,False,,0,,,,,,,,[],,,,
7,1376367507859181568,1376367507859181568,2021-03-29 04:56:00 ora legale Europa occidentale,2021-03-29,04:56:00,200,151967576,attorneycrump,Ben Crump,,"Luther Hall, a Black undercover St. Louis PD detective, was BEATEN UP by his white colleagues during a 2017 protest. But it should have surprised NO ONE because those cops sent text messages beforehand saying they wanted to “beat up protesters!” #EndQualifiedImmunity  https://t.co/VBF1A5PPSU",en,[],[],[],34,364,786,['endqualifiedimmunity'],[],https://twitter.com/AttorneyCrump/status/1376367507859181568,False,,1,https://pbs.twimg.com/amplify_video_thumb/1375535186432163844/img/xBrncDe0E2KLNUoc.jpg,,,,,,,[],,,,
0,1377046902852755456,1377046820694716416,2021-03-31 01:55:40 ora legale Europa occidentale,2021-03-31,01:55:40,200,151967576,attorneycrump,Ben Crump,,"We are demanding change and holding police officers accountable when they break the law. Police reform bills are pending across America, while we are also in the midst of the George Floyd case — one of the highest profile criminal cases against a police officer ever.",en,[],[],[],9,86,530,[],[],https://twitter.com/AttorneyCrump/status/1377046902852755456,False,,0,,,,,,,,[],,,,
1,1377046820694716418,1377046820694716416,2021-03-31 01:55:21 ora legale Europa occidentale,2021-03-31,01:55:21,200,151967576,attorneycrump,Ben Crump,,"Former @WCSOTXSheriff deputies killed Javier Ambler in 2019. Today they were charged with manslaughter! We want to share our strong support for Travis County DA taking first, second &amp; third looks at this questionable police conduct and recognizing criminal conduct. #JavierAmbler  https://t.co/RrMwujCXsy",en,"[{'screen_name': 'wcsotxsheriff', 'name': ""williamson county sheriff's office"", 'id': '1347675242890743809'}]",[],['https://pbs.twimg.com/media/ExxAsSGW8AIGZ-4.jpg'],17,407,1796,['javierambler'],[],https://twitter.com/AttorneyCrump/status/1377046820694716418,False,,1,https://pbs.twimg.com/media/ExxAsSGW8AIGZ-4.jpg,,,,,,,[],,,,
2,1376993381876781059,1376993381876781056,2021-03-30 22:23:00 ora legale Europa occidentale,2021-03-30,22:23:00,200,151967576,attorneycrump,Ben Crump,,We will NOT let them assassinate George Floyd’s character and distract us from the truth: Derek Chauvin dug his knee into George’s neck and murdered him!  https://t.co/hNpV15kD2P,en,[],[],[],39,215,1005,[],[],https://twitter.com/AttorneyCrump/status/1376993381876781059,False,,1,https://pbs.twimg.com/amplify_video_thumb/1376937776499806217/img/OTqfxBm8TaziqDUl.jpg,,,,,,,[],,,,
3,1376953976361484297,1376953976361484288,2021-03-30 19:46:25 ora legale Europa occidentale,2021-03-30,19:46:25,200,151967576,attorneycrump,Ben Crump,,"The first day of the #ChauvinTrial yesterday was POWERFUL, from the prosecutions opening statement to the witnesses who let their humanity lead them! We can only hope that the inhumane MURDER of George Floyd continues to be the only deciding factor in this trial!  https://t.co/kwAWn73dhG",en,[],[],[],15,69,322,['chauvintrial'],[],https://twitter.com/AttorneyCrump/status/1376953976361484297,False,,1,https://pbs.twimg.com/amplify_video_thumb/1376937606563438593/img/X08HzPH7pNiQUbpl.jpg,,,,,,,[],,,,
4,1376871204473212930,1376871204473212928,2021-03-30 14:17:30 ora legale Europa occidentale,2021-03-30,14:17:30,200,151967576,attorneycrump,Ben Crump,,We must protect all of America’s marginalized minorities!! 🙏🏾,en,[],[],[],253,560,2340,[],[],https://twitter.com/AttorneyCrump/status/1376871204473212930,False,https://twitter.com/CeFaanKim/status/1376698713582796804,0,,,,,,,,[],,,,
5,1376734900209004544,1376734900209004544,2021-03-30 05:15:53 ora legale Europa occidentale,2021-03-30,05:15:53,200,151967576,attorneycrump,Ben Crump,,"Derek Chauvin's Drug OD Defense is Pure Smoke Screen, Ben Crump Says  https://t.co/d229dX4xFp",en,[],['https://www.tmz.com/2021/03/29/george-floyd-derek-chauvin-murder-case-rodney-king-ben-crump/'],[],40,119,748,[],[],https://twitter.com/AttorneyCrump/status/1376734900209004544,False,,0,,,,,,,,[],,,,
6,1376727469168939012,1376727469168939008,2021-03-30 04:46:21 ora legale Europa occidentale,2021-03-30,04:46:21,200,151967576,attorneycrump,Ben Crump,,America's promises need to hold true for marginalized minorities too! #DerekChauvinTrial is a historic opportunity to hold America accountable for its promises of equality and justice for ALL. #JusticeForGeorgeFloyd  https://t.co/2VwFHdK9tO,en,[],[],[],19,138,533,"['derekchauvintrial', 'justiceforgeorgefloyd']",[],https://twitter.com/AttorneyCrump/status/1376727469168939012,False,,1,https://pbs.twimg.com/amplify_video_thumb/1376653181850157056/img/0y7a_Bxc7BlsgdvW.jpg,,,,,,,[],,,,
0,1377391797454901252,1377391797454901248,2021-04-01 00:46:09 ora legale Europa occidentale,2021-04-01,00:46:09,200,151967576,attorneycrump,Ben Crump,,"Christian Hall needed help with a mental health emergency! He CRIED OUT for help, and in return @PAStatePolice shot him MULTIPLE TIMES as he surrendered with his hands up!  https://t.co/vjr8OWZ80l",en,"[{'screen_name': 'pastatepolice', 'name': 'pa state police', 'id': '2535036504'}]",[],[],30,128,346,[],[],https://twitter.com/AttorneyCrump/status/1377391797454901252,False,,1,https://pbs.twimg.com/amplify_video_thumb/1377370115277271048/img/HnAfQ5d0ULD72zC5.jpg,,,,,,,[],,,,
1,1377347731895750660,1377347731895750656,2021-03-31 21:51:03 ora legale Europa occidentale,2021-03-31,21:51:03,200,151967576,attorneycrump,Ben Crump,,Reporter: You always talk about 2 justice systems in America. Can you explain? Me: Imagine if George Floyd killed Derek Chauvin by drilling his knee on his neck for 9:29. What would he be charged with? How long of a sentence? How would the media describe him? Reporter: Got it.  https://t.co/qkElHO7Euq,en,[],[],['https://pbs.twimg.com/media/Ex1SdVQXEAM_Irk.jpg'],260,986,3913,[],[],https://twitter.com/AttorneyCrump/status/1377347731895750660,False,,1,https://pbs.twimg.com/media/Ex1SdVQXEAM_Irk.jpg,,,,,,,[],,,,
2,1377287584360042502,1377287584360042496,2021-03-31 17:52:03 ora legale Europa occidentale,2021-03-31,17:52:03,200,151967576,attorneycrump,Ben Crump,,This is BIG: @NYCCouncil is ending qualified immunity for NYPD police officers! Your protests and calls for change led to this HUGE reform. Now we must end qualified immunity nationwide! #BLM  https://t.co/V4enflEOgl,en,"[{'screen_name': 'nyccouncil', 'name': 'nyc council', 'id': '18906097'}]",[],['https://pbs.twimg.com/media/Ex0bwXXWYAsS0BC.jpg'],58,551,2195,['blm'],[],https://twitter.com/AttorneyCrump/status/1377287584360042502,False,,1,https://pbs.twimg.com/media/Ex0bwXXWYAsS0BC.jpg,,,,,,,[],,,,
3,1377253093528760320,1377253093528760320,2021-03-31 15:35:00 ora legale Europa occidentale,2021-03-31,15:35:00,200,151967576,attorneycrump,Ben Crump,,I'm about to GO LIVE with Devon Jacobs in response to the DA’s conclusions in the Christian Hall case. Join us on Facebook at 10AM ET:,en,[],[],[],4,23,109,[],[],https://twitter.com/AttorneyCrump/status/1377253093528760320,False,,0,,,,,,,,[],,,,
4,1377077184280465411,1377077184280465408,2021-03-31 03:56:00 ora legale Europa occidentale,2021-03-31,03:56:00,200,151967576,attorneycrump,Ben Crump,,Derek Chauvin stole George Floyd’s precious life from his family with unforgiving force! NO EXCUSE can justify his MURDER!  https://t.co/IUDwzFWtFA,en,[],[],[],36,223,1124,[],[],https://twitter.com/AttorneyCrump/status/1377077184280465411,False,,1,https://pbs.twimg.com/amplify_video_thumb/1377025842610601991/img/fIPF3mdyUfWECg0Y.jpg,,,,,,,[],,,,
0,1378102056721002500,1378102056721002496,2021-04-02 23:48:28 ora legale Europa occidentale,2021-04-02,23:48:28,200,151967576,attorneycrump,Ben Crump,,America needs to STEP UP and show the world it won’t tolerate violence against marginalized communities! We need #ChauvinTrial to end in a conviction!  https://t.co/O8eX855CEY,en,[],[],[],68,365,1898,['chauvintrial'],[],https://twitter.com/AttorneyCrump/status/1378102056721002500,False,,1,https://pbs.twimg.com/amplify_video_thumb/1378100645945872388/img/tWclHEstnri6OtIN.jpg,,,,,,,[],,,,
1,1378044960277151745,1378044960277151744,2021-04-02 20:01:36 ora legale Europa occidentale,2021-04-02,20:01:36,200,151967576,attorneycrump,Ben Crump,,"Join me on Monday, April 5th at 6pm PT for a virtual conversation presented by The African American Mentoring Program! Register now:  https://t.co/puhSiSE8WY  https://t.co/zQr6KmAJBZ",en,[],['http://tinyurl.com/BenCrump'],['https://pbs.twimg.com/media/Ex_MlgdWgAM2cu8.jpg'],2,19,52,[],[],https://twitter.com/AttorneyCrump/status/1378044960277151745,False,,1,https://pbs.twimg.com/media/Ex_MlgdWgAM2cu8.jpg,,,,,,,[],,,,
2,1378029252331851781,1378029252331851776,2021-04-02 18:59:10 ora legale Europa occidentale,2021-04-02,18:59:10,200,151967576,attorneycrump,Ben Crump,,An off-duty officer employed by Publix harassed &amp; TASED Tawanda Crowell because she was shopping while Black! He trampled on her rights &amp; she deserves JUSTICE for the emotional distress she endured!  https://t.co/bYorph7DoF,en,[],[],[],39,194,605,[],[],https://twitter.com/AttorneyCrump/status/1378029252331851781,False,,1,https://pbs.twimg.com/amplify_video_thumb/1378028991236468743/img/hj5E4ihemQIjU-UU.jpg,,,,,,,[],,,,
3,1378007318772781057,1378007318772781056,2021-04-02 17:32:01 ora legale Europa occidentale,2021-04-02,17:32:01,200,151967576,attorneycrump,Ben Crump,,They FEAR Black women who refuse to ignore racial inequities and police reform. You can try to arrest them but you will NOT silence our Queens' voices!   https://t.co/4WhM2OR7Yu,en,[],['https://19thnews.org/2021/03/law-enforcement-officers-keep-arresting-black-women-elected-officials/'],[],27,353,1725,[],[],https://twitter.com/AttorneyCrump/status/1378007318772781057,False,,0,,,,,,,,[],,,,
4,1377793153919545346,1377793153919545344,2021-04-02 03:21:00 ora legale Europa occidentale,2021-04-02,03:21:00,200,151967576,attorneycrump,Ben Crump,,WOW. @RomeoMiller says LAPD pulled him over at GUNPOINT &amp; accused him of driving a stolen vehicle... because the cop assumed he was “just some random Black dude” driving a nice car. Our skin color does NOT make us a threat!! #DrivingWhileBlack  https://t.co/rsmyXEFjPU,en,"[{'screen_name': 'romeomiller', 'name': 'romeo miller', 'id': '114052770'}]",['https://blavity.com/romeo-miller-says-he-was-pulled-over-at-gunpoint-by-cop-who-told-him-i-thought-you-were-just-some-random-black-dude?category1=news'],[],71,369,1348,['drivingwhileblack'],[],https://twitter.com/AttorneyCrump/status/1377793153919545346,False,,0,,,,,,,,[],,,,
0,1378479680869765122,1378479680869765120,2021-04-04 00:49:01 ora legale Europa occidentale,2021-04-04,00:49:01,200,151967576,attorneycrump,Ben Crump,,The #ChauvinTrial has profound psychological consequences for Black Americans! Viewing racial trauma can create secondary trauma through depression &amp; anxiety. Let this serve as a reminder for us to engage in healthy self-care &amp; protect our mental health!  https://t.co/fcgtviS395,en,[],['https://abcnews.go.com/Health/mental-health-experts-warn-derek-chauvin-trial-revive/story?id=76798368'],[],31,163,667,['chauvintrial'],[],https://twitter.com/AttorneyCrump/status/1378479680869765122,False,,0,,,,,,,,[],,,,
1,1378473886484955136,1378473886484955136,2021-04-04 00:26:00 ora legale Europa occidentale,2021-04-04,00:26:00,200,151967576,attorneycrump,Ben Crump,,Praying for DMX and his family! Pull through my Brother!! 🙏🏾✊🏾  https://t.co/HAYvqT5Yer,en,[],[],[],74,446,3265,[],[],https://twitter.com/AttorneyCrump/status/1378473886484955136,False,,1,https://pbs.twimg.com/ext_tw_video_thumb/1378473840897110020/pu/img/RjzrAPlqLytBdoqx.jpg,,,,,,,[],,,,
2,1378402416509485060,1378402416509485056,2021-04-03 19:42:00 ora legale Europa occidentale,2021-04-03,19:42:00,200,151967576,attorneycrump,Ben Crump,,"Peaches’ farm is 1 of few Black-owned farms left! Discriminatory practices &amp; bullying have robbed Black farmers of generational wealth. They deserve respect, but corporations like @Bayer-Monsanto are profiting off farmers’ backs while putting them in harm's way! #BoycottBayer:",en,"[{'screen_name': 'bayer', 'name': 'bayer ag', 'id': '137319302'}]",[],[],19,174,544,['boycottbayer'],[],https://twitter.com/AttorneyCrump/status/1378402416509485060,False,,0,,,,,,,,[],,,,
3,1378368445583085571,1378368445583085568,2021-04-03 17:27:00 ora legale Europa occidentale,2021-04-03,17:27:00,200,151967576,attorneycrump,Ben Crump,,Lt. Zimmerman testified at the #ChauvinTrial that the deadly force used against George Floyd was “totally unnecessary”! Kneeling on a suspect’s neck is NOT in police training. Derek Chauvin CANNOT hide behind a police procedure that doesn’t exist!  https://t.co/iBIg6jnPKk,en,[],['https://www.clickondetroit.com/news/2021/04/02/duty-sergeant-officers-could-have-ended-floyd-restraint'],[],20,118,666,['chauvintrial'],[],https://twitter.com/AttorneyCrump/status/1378368445583085571,False,,0,,,,,,,,[],,,,
