,id,conversation_id,created_at,date,time,timezone,user_id,username,name,place,tweet,language,mentions,urls,photos,replies_count,retweets_count,likes_count,hashtags,cashtags,link,retweet,quote_url,video,thumbnail,near,geo,source,user_rt_id,user_rt,retweet_id,reply_to,retweet_date,translate,trans_src,trans_dest
0,1311409187130400768,1311409187130400768,2020-09-30 22:54:49 ora legale Europa occidentale,2020-09-30,22:54:49,200,151967576,attorneycrump,Ben Crump,,"Myles Cosgrove fired the shot that killed Breonna Taylor, and now he’s trying to fundraise $75K to “retire”? Why should he get that luxury after taking it away from Bre? It was only “tragic for all involved"" due to the actions taken by all 4 officers!  https://t.co/tRYe5v3SWB",en,[],['https://www.nbcnews.com/news/us-news/officer-breonna-taylor-case-who-fired-fatal-shot-has-fundraiser-n1241432'],[],73,502,1243,[],[],https://twitter.com/AttorneyCrump/status/1311409187130400768,False,,0,,,,,,,,[],,,,
1,1311376970236784640,1311376970236784640,2020-09-30 20:46:48 ora legale Europa occidentale,2020-09-30,20:46:48,200,151967576,attorneycrump,Ben Crump,,"If @KYOAG used the grand jury as a shield in order to not give justice to Breonna Taylor, we NEED to know! We need to know if Bre was disrespected in the courtroom. We need to know if there was transparency. We need the transcripts with no more delays!  https://t.co/1eDg6Kid04",en,"[{'screen_name': 'kyoag', 'name': 'attorney general daniel cameron', 'id': '1205238738097455104'}]",[],[],22,150,445,[],[],https://twitter.com/AttorneyCrump/status/1311376970236784640,False,,1,https://pbs.twimg.com/amplify_video_thumb/1311372527768424449/img/rfkEYTzCYxR9V8oY.jpg,,,,,,,[],,,,
2,1311353822225330181,1311353822225330176,2020-09-30 19:14:49 ora legale Europa occidentale,2020-09-30,19:14:49,200,151967576,attorneycrump,Ben Crump,,Is anyone surprised by this? 🙄  https://t.co/FQuzRL0aOi,en,[],['https://www.usatoday.com/story/news/nation/2020/09/30/daniel-cameron-wants-release-delayed-breonna-taylor-grand-jury-recordings/3586406001/'],[],632,911,3375,[],[],https://twitter.com/AttorneyCrump/status/1311353822225330181,False,,0,,,,,,,,[],,,,
3,1311338849113645058,1311338849113645056,2020-09-30 18:15:19 ora legale Europa occidentale,2020-09-30,18:15:19,200,151967576,attorneycrump,Ben Crump,,"Shame on Tyree Conyers-Page for allegedly defrauding 1000s of BLM supporters by using donations for personal gain. Before donating, confirm the recipient is affiliated w/ a legit organization &amp; will use your $$$ to benefit our people &amp; communities.  https://t.co/5KOil5jwFG",en,[],['https://www.wsbtv.com/news/local/atlanta/atlanta-based-activist-allegedly-used-blm-group-launder-more-than-200k-personal-purchases-fbi-says/IO7SSWUMDZEVLFKBKZQFI57LHM/'],[],28,144,431,[],[],https://twitter.com/AttorneyCrump/status/1311338849113645058,False,,0,,,,,,,,[],,,,
4,1311295509202644994,1311295509202644992,2020-09-30 15:23:06 ora legale Europa occidentale,2020-09-30,15:23:06,200,151967576,attorneycrump,Ben Crump,,"Students ""pranked"" a Black @SFASU cheerleader by calling in a false report to campus police, leading them to swarm into her dorm with guns! This is NOT a prank, it's LIFE-THREATENING, esp. for a Black woman!! States should pass the KAREN Act &amp; make these false reports ILLEGAL!  https://t.co/FecQT39e8u",en,"[{'screen_name': 'sfasu', 'name': 'stephen f. austin state university', 'id': '14858317'}]",[],[],229,1498,3839,[],[],https://twitter.com/AttorneyCrump/status/1311295509202644994,False,,1,https://pbs.twimg.com/amplify_video_thumb/1311016037601677312/img/zVMx_h-qEgQZXVKm.jpg,,,,,,,[],,,,
5,1311139454153666560,1311139454153666560,2020-09-30 05:03:00 ora legale Europa occidentale,2020-09-30,05:03:00,200,151967576,attorneycrump,Ben Crump,,"When a BLACK man with 10 firearms shoots a gun inside his home and resists arrest we schedule a funeral. BUT when it's Trump's former campaign manager (who's white), police offer him repeated assurances like ""We’re going to get you off the ground in just a second, OK?""  https://t.co/lgyg3y79rL",en,[],[],[],108,529,1650,[],[],https://twitter.com/AttorneyCrump/status/1311139454153666560,False,,1,https://pbs.twimg.com/amplify_video_thumb/1311016789418049541/img/ikYQ2jmwMgSZbGQG.jpg,,,,,,,[],,,,
6,1311123994096152576,1311123994096152576,2020-09-30 04:01:34 ora legale Europa occidentale,2020-09-30,04:01:34,200,151967576,attorneycrump,Ben Crump,,Are there two justice systems in America? Yes! And it’s time to finally address this crisis for Black Americans. #PresidentialDebate,en,[],[],[],28,352,2109,['presidentialdebate'],[],https://twitter.com/AttorneyCrump/status/1311123994096152576,False,,0,,,,,,,,[],,,,
7,1311107996437499904,1311107996437499904,2020-09-30 02:58:00 ora legale Europa occidentale,2020-09-30,02:58:00,200,151967576,attorneycrump,Ben Crump,,Disgusting. A data leak revealed that the Trump campaign wanted to deter up of 3.5 million Black voters from voting in the 2016 election. We cannot let them silence our collective voice for change! We must VOTE! ✊🏾 #BidenHarris  https://t.co/FYxrQwUmhB,en,[],['https://thegrio.com/2020/09/28/trump-administration-suppressed-black-vote-over-3-million-2016//'],[],33,466,1227,['bidenharris'],[],https://twitter.com/AttorneyCrump/status/1311107996437499904,False,,0,,,,,,,,[],,,,
0,1312177292253241344,1312177292253241344,2020-10-03 01:47:00 ora legale Europa occidentale,2020-10-03,01:47:00,200,151967576,attorneycrump,Ben Crump,,"Ever heard of #kettling? It's a disgusting tactic used by @NYPDnews to barricade and ATTACK its civilians including essential workers! In what world is it acceptable to ANTAGONIZE, BEAT, and WRONGFULLY arrest PEACEFUL protestors!?  https://t.co/H10SYxx4PP",en,"[{'screen_name': 'nypdnews', 'name': 'nypd news', 'id': '17393196'}]",['https://www.cnn.com/2020/10/01/us/nypd-kettling-human-rights-watch/index.html'],[],57,447,967,['kettling'],[],https://twitter.com/AttorneyCrump/status/1312177292253241344,False,,0,,,,,,,,[],,,,
1,1312133252031959046,1312133252031959040,2020-10-02 22:52:00 ora legale Europa occidentale,2020-10-02,22:52:00,200,151967576,attorneycrump,Ben Crump,,"Despite @LMPD REPEATEDLY being told #BreonnaTaylor WAS NOT receiving suspicious packages, officers STILL insisted on following through with their “investigation”! Just how thorough was this MANHUNT?!  https://t.co/yTl387bbXY",en,"[{'screen_name': 'lmpd', 'name': 'lmpd', 'id': '18904764'}]",['https://www.nydailynews.com/news/national/ny-breonna-taylor-repeatedly-told-packages-drug-investigation-20201002-vu67vzw2p5ft7jgfyg4iv3gk6m-story.html#rt=chartbeat-flt'],[],52,427,1133,['breonnataylor'],[],https://twitter.com/AttorneyCrump/status/1312133252031959046,False,,0,,,,,,,,[],,,,
2,1312082310418911235,1312082310418911232,2020-10-02 19:29:34 ora legale Europa occidentale,2020-10-02,19:29:34,200,151967576,attorneycrump,Ben Crump,,"GRAND JURY RECORDING from #BreonnaTaylor case has been released publicly. With 20+ hours of audio, everyone can now listen to exactly what @kyoag presented to the grand jury! We will be reviewing all footage and provide updates when available.  FULL AUDIO:  https://t.co/fDIOI46KrM",en,"[{'screen_name': 'kyoag', 'name': 'attorney general daniel cameron', 'id': '1205238738097455104'}]",['https://www.newsnationnow.com/us-news/mid-south/breonna-taylor-grand-jury-recording-to-be-released-by-friday-afternoon/'],[],60,676,1595,['breonnataylor'],[],https://twitter.com/AttorneyCrump/status/1312082310418911235,False,,0,,,,,,,,[],,,,
3,1312053918046842885,1312053918046842880,2020-10-02 17:36:45 ora legale Europa occidentale,2020-10-02,17:36:45,200,151967576,attorneycrump,Ben Crump,,"“I beat the ever-living f*** out of him,” Louisiana Trooper Chris Hollingsworth BRAGGED after killing #RonaldGreene, a Black man. Cops tried to cover up his death saying it was due to a crash, but audio from Hollingsworth’s bodycam PROVES this was death by COP!! DISGUSTING.  https://t.co/FxrKgLYz7q",en,[],[],[],345,3358,5317,['ronaldgreene'],[],https://twitter.com/AttorneyCrump/status/1312053918046842885,False,,1,https://pbs.twimg.com/amplify_video_thumb/1312048507189112833/img/WSpOcNBByzXEOyF_.jpg,,,,,,,[],,,,
4,1312026297661620229,1312026297661620224,2020-10-02 15:47:00 ora legale Europa occidentale,2020-10-02,15:47:00,200,151967576,attorneycrump,Ben Crump,,"Yes, @GavinNewsom! This corporate boardroom diversity law is a WIN for representation &amp; racial equality, esp. with COVID-19 disproportionately affecting minorities. Leadership should be as diverse as the people it serves. We need to do this in EVERY state!  https://t.co/3WTkVyvMoT",en,"[{'screen_name': 'gavinnewsom', 'name': 'gavin newsom', 'id': '11347122'}]",['https://fox40.com/news/california-connection/governor-newsom-signs-corporate-boardroom-diversity-law/'],[],12,115,577,[],[],https://twitter.com/AttorneyCrump/status/1312026297661620229,False,,0,,,,,,,,[],,,,
5,1311856176427077633,1311856176427077632,2020-10-02 04:31:00 ora legale Europa occidentale,2020-10-02,04:31:00,200,151967576,attorneycrump,Ben Crump,,"GRAPHIC: Shataean Kelly was handcuffed, hogtied &amp; driven UPSIDE DOWN in a cop car for 21 mins. Incredibly upsetting &amp; reminds me of Freddie Gray's death in police custody. Cops must treat people with RESPECT. It's unacceptable that ANYONE should have to beg for their life!  https://t.co/244JQH91RK",en,[],[],[],143,770,1415,[],[],https://twitter.com/AttorneyCrump/status/1311856176427077633,False,,1,https://pbs.twimg.com/amplify_video_thumb/1311788533057757188/img/fEiEsvuazLjbUz81.jpg,,,,,,,[],,,,
6,1311839063624695808,1311839063624695808,2020-10-02 03:23:00 ora legale Europa occidentale,2020-10-02,03:23:00,200,151967576,attorneycrump,Ben Crump,,"Usually POC are profiled because they ""fit a description"" ... Jaaye Person-Lynn did NOT fit the description (aka stereotype) of a lawyer. Kicked out of court, tased, tackled AND arrested because officers did not believe Jaaye was a lawyer. There are 2 justice systems in America!!  https://t.co/1cFm3gWeiJ",en,[],[],[],176,1239,2732,[],[],https://twitter.com/AttorneyCrump/status/1311839063624695808,False,,1,https://pbs.twimg.com/amplify_video_thumb/1311782649275584512/img/MZHcnyqCDXth7J_W.jpg,,,,,,,[],,,,
7,1311820441011408897,1311820441011408896,2020-10-02 02:09:00 ora legale Europa occidentale,2020-10-02,02:09:00,200,151967576,attorneycrump,Ben Crump,,"Driving while Black entails so much more than simply driving while Black."" Exactly! 🙌🏾  This powerful @PBS documentary will explore discrimination and danger faced by Black drivers in America. Excited to watch this on 10/13!  https://t.co/NN65mYg9Ta",en,"[{'screen_name': 'pbs', 'name': 'pbs', 'id': '12133382'}]",['https://pbs.org/video/trailer-5ux5ln/'],[],21,573,1354,[],[],https://twitter.com/AttorneyCrump/status/1311820441011408897,False,,0,,,,,,,,[],,,,
0,1312877909015777281,1312877909015777280,2020-10-05 00:11:00 ora legale Europa occidentale,2020-10-05,00:11:00,200,151967576,attorneycrump,Ben Crump,,Lamar Street – where Botham Jean was shot and killed in his OWN home – was named after SLAVEHOLDER. Help us change its name to Botham Jean Blvd in honor of Botham. Let's remind everyone that BLACK LIVES MATTER. Sign the petition:  https://t.co/RN3UjWzQAR,en,[],['https://action.bencrump.com/bothamjean?utm_source=t.co&utm_medium=referral&utm_campaign=social_organic&utm_content=100420'],[],16,269,985,[],[],https://twitter.com/AttorneyCrump/status/1312877909015777281,False,,0,,,,,,,,[],,,,
1,1312858279492624386,1312858279492624384,2020-10-04 22:53:00 ora legale Europa occidentale,2020-10-04,22:53:00,200,151967576,attorneycrump,Ben Crump,,"#BlackGrief is at an ALL-TIME HIGH! Black people have ALWAYS carried a disproportionate amount of grief in America, but 2020 has revealed many ways our community has been hit AND not been able to recover. Grief has always been an #EqualityProblem!  https://t.co/8Lmm7ZRE0W",en,[],['https://www.theatlantic.com/ideas/archive/2020/09/relentlessness-black-grief/616511/'],[],17,232,958,"['blackgrief', 'equalityproblem']",[],https://twitter.com/AttorneyCrump/status/1312858279492624386,False,,0,,,,,,,,[],,,,
2,1312791590365065216,1312791590365065216,2020-10-04 18:28:00 ora legale Europa occidentale,2020-10-04,18:28:00,200,151967576,attorneycrump,Ben Crump,,"Many airline professionals of color STILL encounter racial discrimination daily... If you or someone you know has been the victim of this discrimination, let me know! We must raise ours voices in unity and fight for change and equality!! Share YOUR story:  https://t.co/FOFX96wZKy  https://t.co/VwrxZnx2HW",en,[],['https://act.bencrump.com/a/airline-discrimination?utm_source=t.co&utm_medium=referral&utm_campaign=social_organic&utm_content=100420'],['https://pbs.twimg.com/media/EjWtkT3XYAEOPbc.jpg'],10,63,250,[],[],https://twitter.com/AttorneyCrump/status/1312791590365065216,False,,1,https://pbs.twimg.com/media/EjWtkT3XYAEOPbc.jpg,,,,,,,[],,,,
3,1312761139508523011,1312761139508523008,2020-10-04 16:27:00 ora legale Europa occidentale,2020-10-04,16:27:00,200,151967576,attorneycrump,Ben Crump,,"Broadway's nickname ""The Great White Way"" is true in more ways than one: There's an overwhelming lack of Black representation in theatre, with 94% of directors &amp; 2/3 of actors being white. This needs to change. Black Talent Matters!!  https://t.co/qIonqViwlH",en,[],['https://www.nytimes.com/2020/10/01/theater/new-york-theater-diversity-report.html'],[],37,176,976,[],[],https://twitter.com/AttorneyCrump/status/1312761139508523011,False,,0,,,,,,,,[],,,,
4,1312569124267216896,1312569124267216896,2020-10-04 03:44:00 ora legale Europa occidentale,2020-10-04,03:44:00,200,151967576,attorneycrump,Ben Crump,,"Racism is STILL alive across America, &amp; deeply rooted in much of the SOUTH. Louisiana has sprouted vicious &amp; visible examples of systemic racism. #LafayetteLA marched PEACEFULLY for #TrayfordPellerin as Louisiana officials CONTINUE to cover up MURDERS!  https://t.co/YPGFVfSmUc",en,[],['https://www.bigeasymagazine.com/2020/09/24/roux-racism-and-reality/'],[],29,220,817,"['lafayettela', 'trayfordpellerin']",[],https://twitter.com/AttorneyCrump/status/1312569124267216896,False,,0,,,,,,,,[],,,,
0,1313256906295775234,1313256906295775232,2020-10-06 01:17:00 ora legale Europa occidentale,2020-10-06,01:17:00,200,151967576,attorneycrump,Ben Crump,,Anyone surprised by this?  https://t.co/8i9w98CLCQ,en,[],['https://www.bet.com/news/national/2020/10/05/ahmaud-arbey-racist-social-media.html'],[],281,730,2678,[],[],https://twitter.com/AttorneyCrump/status/1313256906295775234,False,,0,,,,,,,,[],,,,
1,1313242529387679752,1313242529387679744,2020-10-06 00:19:52 ora legale Europa occidentale,2020-10-06,00:19:52,200,151967576,attorneycrump,Ben Crump,,This is HUGE! ✊🏾,en,[],[],[],24,488,2825,[],[],https://twitter.com/AttorneyCrump/status/1313242529387679752,False,https://twitter.com/sfchronicle/status/1313239524718280711,0,,,,,,,,[],,,,
2,1313228213452242950,1313228213452242944,2020-10-05 23:22:59 ora legale Europa occidentale,2020-10-05,23:22:59,200,151967576,attorneycrump,Ben Crump,,Police hit Tyris Johnson with 5 bullets in the arm &amp; back. They said he was carrying a weapon BUT nothing was found at the scene! Police need to STOP investigating officer-involved shootings by acting first &amp; asking questions later! What happened to INNOCENT until proven guilty?  https://t.co/YKrmu88VPr,en,[],[],[],26,238,596,[],[],https://twitter.com/AttorneyCrump/status/1313228213452242950,False,,1,https://pbs.twimg.com/amplify_video_thumb/1313225440585224192/img/eflki_NX7croMdsc.jpg,,,,,,,[],,,,
3,1313204192891359234,1313204084862865408,2020-10-05 21:47:32 ora legale Europa occidentale,2020-10-05,21:47:32,200,151967576,attorneycrump,Ben Crump,,"Adding insult to injury... Edward Murray was given a $160K bond after fleeing the scene AND being previously convicted of aggravated sexual assault on a child! If he were a Black man with the same record, he would have absolutely been DENIED bail!!",en,[],[],[],38,289,1188,[],[],https://twitter.com/AttorneyCrump/status/1313204192891359234,False,,0,,,,,,,,[],,,,
4,1313204084862865410,1313204084862865408,2020-10-05 21:47:06 ora legale Europa occidentale,2020-10-05,21:47:06,200,151967576,attorneycrump,Ben Crump,,Edward Murray TERRORIZED Antonio Robinson's family with constant racist slurs for over a year! Then Murray FATALLY SHOT Antonio 5x in his chest... in an unprovoked attack in front of his 9yo son who was forced to try to stop his father's bleeding! THIS was racial terrorism!!  https://t.co/xWhcm4tEX9,en,[],[],['https://pbs.twimg.com/media/EjlwHXwWAAIJaTd.jpg'],38,813,1957,[],[],https://twitter.com/AttorneyCrump/status/1313204084862865410,False,,1,https://pbs.twimg.com/media/EjlwHXwWAAIJaTd.jpg,,,,,,,[],,,,
5,1313177575393550336,1313177382593785856,2020-10-05 20:01:46 ora legale Europa occidentale,2020-10-05,20:01:46,200,151967576,attorneycrump,Ben Crump,,Sign your name and demand AG Cameron appoint a new INDEPENDENT special prosecutor on Breonna Taylor’s case ASAP!  https://t.co/HMwpz8qs9j,en,[],['https://act.bencrump.com/a/breonna-taylor?utm_source=t.co&utm_medium=referral&utm_campaign=social_organic&utm_content=100520'],[],14,168,460,[],[],https://twitter.com/AttorneyCrump/status/1313177575393550336,False,,0,,,,,,,,[],,,,
6,1313177382593785856,1313177382593785856,2020-10-05 20:01:00 ora legale Europa occidentale,2020-10-05,20:01:00,200,151967576,attorneycrump,Ben Crump,,"The grand jury audio PROVES that Breonna Taylor did not have a voice in her proceedings!! The grand jury wanted to hear MORE EVIDENCE, but @KYOAG denied Bre justice by not presenting a complete account of what happened.  https://t.co/l5ZDL4R5Sk",en,"[{'screen_name': 'kyoag', 'name': 'attorney general daniel cameron', 'id': '1205238738097455104'}]",[],[],23,448,1058,[],[],https://twitter.com/AttorneyCrump/status/1313177382593785856,False,,1,https://pbs.twimg.com/amplify_video_thumb/1313132616963555328/img/tCDALtDfxkU_ZJv5.jpg,,,,,,,[],,,,
7,1313165080893284357,1313165080893284352,2020-10-05 19:12:07 ora legale Europa occidentale,2020-10-05,19:12:07,200,151967576,attorneycrump,Ben Crump,,"Jonathan Price was a “pillar of the community” and was simply trying to help those in need... but was assaulted, tased, shot and KILLED on Saturday by Wolfe City police. When will open season end on our Black brothers and sisters?? We demand #JusticeForJonathan!!  https://t.co/fADtANn3cN",en,[],[],[],109,912,1779,['justiceforjonathan'],[],https://twitter.com/AttorneyCrump/status/1313165080893284357,False,,1,https://pbs.twimg.com/amplify_video_thumb/1313155324711493632/img/kUuLCjxl5ofmipFH.jpg,,,,,,,[],,,,
8,1313105333720670208,1313105333720670208,2020-10-05 15:14:42 ora legale Europa occidentale,2020-10-05,15:14:42,200,151967576,attorneycrump,Ben Crump,,Today is the last day to register to vote in the state of Florida. Make sure you register or postmark your registration on today! #BeAnOctoberVoter #GOTV  https://t.co/B4hn4gy6A1,en,[],[],['https://pbs.twimg.com/media/EjkWVt8WoAEpTZY.jpg'],5,191,332,"['beanoctobervoter', 'gotv']",[],https://twitter.com/AttorneyCrump/status/1313105333720670208,False,,1,https://pbs.twimg.com/media/EjkWVt8WoAEpTZY.jpg,,,,,,,[],,,,
9,1313105281136709636,1313105281136709632,2020-10-05 15:14:29 ora legale Europa occidentale,2020-10-05,15:14:29,200,151967576,attorneycrump,Ben Crump,,Today is the last day to register to vote in the state of Florida. Make sure you register or postmark your registration on today! #BeAnOctoberVoter #GOTV  https://t.co/EY1p72gVKh,en,[],[],['https://pbs.twimg.com/media/EjkWSsqWoAEOTtO.jpg'],2,83,137,"['beanoctobervoter', 'gotv']",[],https://twitter.com/AttorneyCrump/status/1313105281136709636,False,,1,https://pbs.twimg.com/media/EjkWSsqWoAEOTtO.jpg,,,,,,,[],,,,
10,1312962453026807809,1312962453026807808,2020-10-05 05:46:57 ora legale Europa occidentale,2020-10-05,05:46:57,200,151967576,attorneycrump,Ben Crump,,"Thomas Jefferson Byrd, actor and fellow @OfficialOPPF brother known for many roles in Spike Lee films, was fatally shot in Atlanta this weekend. Sending my deepest prayers and condolences to Tom’s family. 🙏🏾  https://t.co/4SBGtrLqJ1",en,"[{'screen_name': 'officialoppf', 'name': 'omega psi phi', 'id': '119974603'}]",['https://www.ajc.com/news/actor-thomas-jefferson-byrd-killed-in-atlanta-sources-say/C5YGCZVVJZC4FJBH5XX2IVY654/'],[],84,400,1841,[],[],https://twitter.com/AttorneyCrump/status/1312962453026807809,False,,0,,,,,,,,[],,,,
11,1312916915929653249,1312916915929653248,2020-10-05 02:46:00 ora legale Europa occidentale,2020-10-05,02:46:00,200,151967576,attorneycrump,Ben Crump,,Our system is broken. We must eliminate the “Hunt for Black People” by reforming how the current system works. That includes teaching ALL cops to police with respect. We must END this open season on Black people.  https://t.co/rpxXTJlTpT,en,[],[],[],70,652,1858,[],[],https://twitter.com/AttorneyCrump/status/1312916915929653249,False,,1,https://pbs.twimg.com/amplify_video_thumb/1311015960581726208/img/9RmcK4C_tmaXZOiJ.jpg,,,,,,,[],,,,
0,1313622313959518209,1313622313959518208,2020-10-07 01:29:00 ora legale Europa occidentale,2020-10-07,01:29:00,200,151967576,attorneycrump,Ben Crump,,"WOW! Walter Mosley will be the FIRST BLACK person ever to receive @NationalBook Lifetime Achievement Award! 📚  He's a bestselling author, diversity advocate, and mentor of disadvantaged students. Now that's #BlackExcellence! 👏🏾  https://t.co/UfkR6p7YVu",en,"[{'screen_name': 'nationalbook', 'name': 'national book foundation', 'id': '16220088'}]",['https://thegrio.com/2020/10/04/walter-mosley-lifetime-achievement-award/'],[],12,147,777,['blackexcellence'],[],https://twitter.com/AttorneyCrump/status/1313622313959518209,False,,0,,,,,,,,[],,,,
1,1313580287150845952,1313580287150845952,2020-10-06 22:42:00 ora legale Europa occidentale,2020-10-06,22:42:00,200,151967576,attorneycrump,Ben Crump,,"Props to @TheRealZSmith for unapologetically standing with Black women! After his QB sack to end the 1st half and with all cameras on him, Za’Darius revealed ""Rest in Heaven Breonna Taylor"" on his undershirt – sending a clear message in support of #JusticeForBre!  https://t.co/MpYEyi3kO7",en,"[{'screen_name': 'therealzsmith', 'name': 'ah', 'id': '1288095463443509248'}]",[],['https://pbs.twimg.com/media/Ejq7HM6WAAARRjV.jpg'],15,178,1331,['justiceforbre'],[],https://twitter.com/AttorneyCrump/status/1313580287150845952,False,,1,https://pbs.twimg.com/media/Ejq7HM6WAAARRjV.jpg,,,,,,,[],,,,
2,1313556631129452544,1313556631129452544,2020-10-06 21:08:00 ora legale Europa occidentale,2020-10-06,21:08:00,200,151967576,attorneycrump,Ben Crump,,We wouldn’t need the “Ben Crump Playbook” if @KYOAG pursued justice for Breonna Taylor in the first place. Now step aside and let someone do the job you FAILED to do. #JusticeForBre  https://t.co/NBBLCPWJyo,en,"[{'screen_name': 'kyoag', 'name': 'attorney general daniel cameron', 'id': '1205238738097455104'}]",[],['https://pbs.twimg.com/media/EjqsYMUXsAAtdvQ.jpg'],18,83,297,['justiceforbre'],[],https://twitter.com/AttorneyCrump/status/1313556631129452544,False,,1,https://pbs.twimg.com/media/EjqsYMUXsAAtdvQ.jpg,,,,,,,[],,,,
3,1313460497795096576,1313460497795096576,2020-10-06 14:46:00 ora legale Europa occidentale,2020-10-06,14:46:00,200,151967576,attorneycrump,Ben Crump,,What a POWERFUL performance by @TheeStallion on @NBCSNL! Thank you for your nod to Breonna Taylor and for reminding others to protect Black men and women because Black Lives Matter!! #SayHerName  https://t.co/JIKoUav4Uy,en,"[{'screen_name': 'theestallion', 'name': 'tina snow', 'id': '104040220'}, {'screen_name': 'nbcsnl', 'name': 'saturday night live - snl', 'id': '28221296'}]",[],[],29,312,1755,['sayhername'],[],https://twitter.com/AttorneyCrump/status/1313460497795096576,False,,1,https://pbs.twimg.com/amplify_video_thumb/1313155324707328004/img/vahQP0KT3re3Fhpc.jpg,,,,,,,[],,,,
4,1313319065881059328,1313319065881059328,2020-10-06 05:24:00 ora legale Europa occidentale,2020-10-06,05:24:00,200,151967576,attorneycrump,Ben Crump,,"Newly released autopsy report finds that #DijonKizzee was shot 16 TIMES, four causing ""rapidly fatal injuries."" It states his death was a homicide, noting the injury occurred by law enforcement! The involved officers must be held accountable NOW.  https://t.co/KDPJx6sfbM",en,[],['https://www.cnn.com/2020/10/03/us/dijon-kizzee-autopsy-report/index.html'],[],68,978,2576,['dijonkizzee'],[],https://twitter.com/AttorneyCrump/status/1313319065881059328,False,,0,,,,,,,,[],,,,
5,1313293396757409792,1313293396757409792,2020-10-06 03:42:00 ora legale Europa occidentale,2020-10-06,03:42:00,200,151967576,attorneycrump,Ben Crump,,"This racist woman HARASSED Philip Evans, an innocent Black man, because he ""looked funny"" while grocery shopping! She told 911 “I hope you get him!” Black people have targets on our backs, even while doing normal daily activities! Another day, another #WhileBlack incident...  https://t.co/I3GBYf4emH",en,[],[],[],269,801,1853,['whileblack'],[],https://twitter.com/AttorneyCrump/status/1313293396757409792,False,,1,https://pbs.twimg.com/amplify_video_thumb/1313240075921219584/img/r34mqTQL4J7hOUHr.jpg,,,,,,,[],,,,
